"Name";"Bereich";"Information";"V.-Datum";"Relevanz";"session.sessionid=";"fts_search_list.selected";"fts_search_list.destHistoryId";"timestamp"
"Mülldeponie Altenberge GmbH & Co. KG Altenberge";"Rechnungslegung/ Finanzberichte";"» Jahresabschluss zum Geschäftsjahr vom 01.07.2018 bis zum 30.06.2019";"30.06.2020";"100%";"0d747c0b2dd5781887ce3d83356491d9";"7e9b6f7d58476a9b";"66870";"Wed Jul  8 23:24:43 2020"
"Wintersport Altenberg (Osterzgebirge) GmbH Altenberg";"Rechnungslegung/ Finanzberichte";"» Jahresabschluss zum Geschäftsjahr vom 01.10.2018 bis zum 30.09.2019";"28.05.2020";"100%";"0d747c0b2dd5781887ce3d83356491d9";"2c30df9f9ddd1b27";"66870";"Wed Jul  8 23:24:43 2020"
"GartenCenter ALTENBERGE K & L GmbH & Co. KG Altenberge";"Rechnungslegung/ Finanzberichte";"» Jahresabschluss zum Geschäftsjahr vom 01.05.2018 bis zum 30.04.2019";"11.05.2020";"100%";"0d747c0b2dd5781887ce3d83356491d9";"e1e3f7ffdd19f5c3";"66870";"Wed Jul  8 23:24:43 2020"
"Benefiz Kloster Altenberg gGmbH Solms";"Rechnungslegung/ Finanzberichte";"» Jahresabschluss zum Geschäftsjahr vom 01.01.2018 bis zum 31.12.2018";"27.04.2020";"100%";"0d747c0b2dd5781887ce3d83356491d9";"6ce25ebba7b95409";"66870";"Wed Jul  8 23:24:43 2020"
"Altenberger Heizungs-,  Sanitär- und Brandschutz-GmbH & Co. KG. Altenberg";"Rechnungslegung/ Finanzberichte";"» Jahresabschluss zum Geschäftsjahr vom 01.01.2018 bis zum 31.12.2018";"06.03.2020";"100%";"0d747c0b2dd5781887ce3d83356491d9";"e61a4eca768859ce";"66870";"Wed Jul  8 23:24:44 2020"
"Heide-Hof Altenberge Verwaltungs GmbH Altenberge";"Rechnungslegung/ Finanzberichte";"» Jahresabschluss zum Geschäftsjahr vom 01.01.2018 bis zum 31.12.2018";"04.03.2020";"100%";"0d747c0b2dd5781887ce3d83356491d9";"f91e5a8d2cb90c42";"66870";"Wed Jul  8 23:24:44 2020"
"Heide-Hof Altenberge GmbH & Co. KG Altenberge";"Rechnungslegung/ Finanzberichte";"» Jahresabschluss zum Geschäftsjahr vom 01.01.2018 bis zum 31.12.2018";"25.02.2020";"100%";"0d747c0b2dd5781887ce3d83356491d9";"bb51d57c911d1e89";"66870";"Wed Jul  8 23:24:44 2020"
"Wohnungsgenossenschaft Glück Auf Geising - Altenberg eG Geising";"Rechnungslegung/ Finanzberichte";"» Jahresabschluss zum Geschäftsjahr vom 01.01.2018 bis zum 31.12.2018";"20.02.2020";"100%";"0d747c0b2dd5781887ce3d83356491d9";"52e75d637ce7edb3";"66870";"Wed Jul  8 23:24:44 2020"
"Altenberger Tourismus und Veranstaltungs GmbH Altenberg";"Rechnungslegung/ Finanzberichte";"» Jahresabschluss zum Geschäftsjahr vom 01.01.2018 bis zum 31.12.2018";"14.02.2020";"100%";"0d747c0b2dd5781887ce3d83356491d9";"fee290f9a334fe15";"66870";"Wed Jul  8 23:24:44 2020"
"Altenberg Soziokultur GmbH Oberhausen";"Rechnungslegung/ Finanzberichte";"» Jahresabschluss zum Geschäftsjahr vom 01.01.2018 bis zum 31.12.2018";"30.01.2020";"100%";"0d747c0b2dd5781887ce3d83356491d9";"460e60672211e06a";"66870";"Wed Jul  8 23:24:44 2020"
"Altenberger Bedachungs- und Bauunternehmen GmbH Altenberg";"Rechnungslegung/ Finanzberichte";"» Jahresabschluss zum Geschäftsjahr vom 01.01.2018 bis zum 31.12.2018";"29.01.2020";"100%";"0d747c0b2dd5781887ce3d83356491d9";"4fa46e852a187289";"66870";"Wed Jul  8 23:24:44 2020"
"Hotel-Restaurant Altenberger Hof GmbH Odenthal";"Rechnungslegung/ Finanzberichte";"» Jahresabschluss zum Geschäftsjahr vom 01.01.2018 bis zum 31.12.2018";"29.01.2020";"100%";"0d747c0b2dd5781887ce3d83356491d9";"a94cacba8c263f1a";"66870";"Wed Jul  8 23:24:44 2020"
"Wohnungsbau- und Verwaltungsgesellschaft Altenberg mbH Altenberg";"Rechnungslegung/ Finanzberichte";"» Jahresabschluss zum Geschäftsjahr vom 01.01.2018 bis zum 31.12.2018";"13.01.2020";"100%";"0d747c0b2dd5781887ce3d83356491d9";"1f210e2defd1850f";"66870";"Wed Jul  8 23:24:44 2020"
"Projektgesellschaft Altenberg mbH Umnutzung Industriebrache Zinnerz Altenberg";"Rechnungslegung/ Finanzberichte";"» Jahresabschluss zum Geschäftsjahr vom 01.01.2018 bis zum 31.12.2018";"19.12.2019";"100%";"0d747c0b2dd5781887ce3d83356491d9";"44068f6ef14a1d2e";"66870";"Wed Jul  8 23:24:44 2020"
"Altenberger Elektroservice GmbH Hockenheim";"Rechnungslegung/ Finanzberichte";"» Jahresabschluss zum Geschäftsjahr vom 01.01.2018 bis zum 31.12.2018";"16.12.2019";"100%";"0d747c0b2dd5781887ce3d83356491d9";"cee580ec8c32aa8a";"66870";"Wed Jul  8 23:24:44 2020"
"Hotel-Restaurant Altenberger Hof GmbH Odenthal";"Rechnungslegung/ Finanzberichte";"» Jahresabschluss zum Geschäftsjahr vom 01.01.2017 bis zum 31.12.2017 Ergänzung der Veröffentlichung vom 27.12.2018";"16.12.2019";"100%";"0d747c0b2dd5781887ce3d83356491d9";"0df3730b6fc7a213";"66870";"Wed Jul  8 23:24:44 2020"
"Agrartechnik Altenberge GmbH Altenberge";"Rechnungslegung/ Finanzberichte";"» Jahresabschluss zum Geschäftsjahr vom 01.01.2018 bis zum 31.12.2018";"09.12.2019";"100%";"0d747c0b2dd5781887ce3d83356491d9";"f53c1ca42defd81a";"66870";"Wed Jul  8 23:24:44 2020"
"Technische Dienste Altenberg Gesellschaft mit beschränkter Haftung Altenberg";"Rechnungslegung/ Finanzberichte";"» Jahresabschluss zum Geschäftsjahr vom 01.06.2017 bis zum 31.05.2018";"04.09.2019";"100%";"0d747c0b2dd5781887ce3d83356491d9";"9705e60d7237a1b3";"66870";"Wed Jul  8 23:24:44 2020"
"Mülldeponie Altenberge GmbH & Co. KG Altenberge";"Rechnungslegung/ Finanzberichte";"» Jahresabschluss zum Geschäftsjahr vom 01.07.2017 bis zum 30.06.2018";"02.07.2019";"100%";"0d747c0b2dd5781887ce3d83356491d9";"fff2d1979abe9552";"66870";"Wed Jul  8 23:24:44 2020"
"Kreissparkasse Steinfurt - Zweckverbandssparkasse des Kreises Steinfurt und der Städte
                                       und Gemeinden Altenberge,  Greven,  Hörstel,  Hopsten,  Horstmar,  Ibbenbüren,  Ladbergen,  Laer,  Lienen,  Lotte,  Metelen,  Mettingen,  Neuenkirchen,  Nordwalde,  Recke,  Saerbeck,  Steinfurt,  Tecklenburg,  Westerkappeln und Wettringen Ibbenbüren";"Rechnungslegung/ Finanzberichte";"» Jahresabschluss zum Geschäftsjahr vom 01.01.2018 bis zum 31.12.2018";"28.06.2019";"100%";"0d747c0b2dd5781887ce3d83356491d9";"cb5eca615c92738f";"66870";"Wed Jul  8 23:24:44 2020"
