"Name";"Bereich";"Information";"V.-Datum";"Relevanz";"session.sessionid=";"fts_search_list.selected";"fts_search_list.destHistoryId";"timestamp"
"BE-terna Industry Solutions GmbH Sindelfingen";"Rechnungslegung/ Finanzberichte";"» Jahresabschluss zum Geschäftsjahr vom 01.01.2018 bis zum 31.12.2018";"08.04.2020";"100%";"0d747c0b2dd5781887ce3d83356491d9";"91877c491d8b4356";"48713";"Thu Jul  9 00:08:19 2020"
"BE-terna Germany GmbH Leipzig";"Rechnungslegung/ Finanzberichte";"» Jahresabschluss zum Geschäftsjahr vom 01.01.2018 bis zum 31.12.2018";"19.03.2020";"100%";"0d747c0b2dd5781887ce3d83356491d9";"1c902f460147131b";"48713";"Thu Jul  9 00:08:19 2020"
"BE-terna GmbH Leipzig";"Rechnungslegung/ Finanzberichte";"» Jahresabschluss zum Geschäftsjahr vom 01.01.2018 bis zum 31.12.2018";"11.02.2020";"100%";"0d747c0b2dd5781887ce3d83356491d9";"64c4513dd510771c";"48713";"Thu Jul  9 00:08:19 2020"
"BE-terna Holding GmbH Leipzig";"Rechnungslegung/ Finanzberichte";"» Konzernabschluss zum Geschäftsjahr vom 01.01.2018 bis zum 31.12.2018";"21.01.2020";"100%";"0d747c0b2dd5781887ce3d83356491d9";"17683eac5cf3f8e8";"48713";"Thu Jul  9 00:08:19 2020"
"BE-terna GmbH,  Niederlassung Deutschland Villingen-Schwenningen";"Rechnungslegung/ Finanzberichte";"» Befreiender Jahresabschluss gem. §325 a HGB zum Geschäftsjahr vom 01.01.2018 bis zum
                                          31.12.2018";"30.12.2019";"100%";"0d747c0b2dd5781887ce3d83356491d9";"1f2f1c9ba93303f9";"48713";"Thu Jul  9 00:08:19 2020"
"BE-terna Business Solutions GmbH Überlingen";"Rechnungslegung/ Finanzberichte";"» Jahresabschluss zum Geschäftsjahr vom 01.01.2018 bis zum 31.12.2018";"22.10.2019";"100%";"0d747c0b2dd5781887ce3d83356491d9";"9a348c0c5aa331a8";"48713";"Thu Jul  9 00:08:19 2020"
"BE-terna GmbH,  Niederlassung Deutschland Villingen-Schwenningen";"Rechnungslegung/ Finanzberichte";"» Befreiender Jahresabschluss gem. §325 a HGB zum Geschäftsjahr vom 01.01.2017 bis zum
                                          31.12.2017";"29.03.2019";"100%";"0d747c0b2dd5781887ce3d83356491d9";"b108d9eff70fb24e";"48713";"Thu Jul  9 00:08:19 2020"
"BE-terna Germany GmbH Leipzig";"Rechnungslegung/ Finanzberichte";"» Jahresabschluss zum Geschäftsjahr vom 01.01.2017 bis zum 31.12.2017";"27.02.2019";"100%";"0d747c0b2dd5781887ce3d83356491d9";"166e7ebf83c577cc";"48713";"Thu Jul  9 00:08:19 2020"
"BE-terna GmbH (vormals: BEDAV GmbH) Leipzig";"Rechnungslegung/ Finanzberichte";"» Jahresabschluss zum Geschäftsjahr vom 01.01.2017 bis zum 31.12.2017";"04.02.2019";"100%";"0d747c0b2dd5781887ce3d83356491d9";"2bde7e46c6518ea6";"48713";"Thu Jul  9 00:08:19 2020"
"BE-terna Business Solutions GmbH (vormals: eNovation Business IT GmbH) Überlingen";"Rechnungslegung/ Finanzberichte";"» Jahresabschluss zum Geschäftsjahr vom 01.01.2017 bis zum 31.12.2017";"26.11.2018";"100%";"0d747c0b2dd5781887ce3d83356491d9";"21541e52ddac55b8";"48713";"Thu Jul  9 00:08:19 2020"
"BE-terna Industry Solutions GmbH (vormals: COMPUTENZ Business Solutions GmbH) Sindelfingen";"Rechnungslegung/ Finanzberichte";"» Jahresabschluss zum Geschäftsjahr vom 01.01.2017 bis zum 31.12.2017";"23.08.2018";"100%";"0d747c0b2dd5781887ce3d83356491d9";"93db866309af35b2";"48713";"Thu Jul  9 00:08:19 2020"
"BE-terna GmbH,  Niederlassung Deutschland (vormals: TERNA GmbH - Zentrum für Business Software) Villingen-Schwenningen";"Rechnungslegung/ Finanzberichte";"» Befreiender Jahresabschluss gem. §325 a HGB zum Geschäftsjahr vom 01.01.2016 bis zum
                                          31.12.2016";"14.05.2018";"95%";"0d747c0b2dd5781887ce3d83356491d9";"670abf21da64408b";"48713";"Thu Jul  9 00:08:19 2020"
"BE-terna GmbH (vormals: BEDAV GmbH) Leipzig";"Rechnungslegung/ Finanzberichte";"» Jahresabschluss zum Geschäftsjahr vom 01.04.2016 bis zum 31.12.2016";"08.03.2018";"95%";"0d747c0b2dd5781887ce3d83356491d9";"f83f85f225465d59";"48713";"Thu Jul  9 00:08:19 2020"
"BE-terna Germany GmbH (vormals: BEDAV Beteiligungs GmbH) Leipzig (vormals: Hamburg)";"Rechnungslegung/ Finanzberichte";"» Jahresabschluss zum Geschäftsjahr vom 01.04.2016 bis zum 31.12.2016";"19.02.2018";"95%";"0d747c0b2dd5781887ce3d83356491d9";"dec07c7071f4fbcd";"48713";"Thu Jul  9 00:08:19 2020"
"BE-terna Germany GmbH (vormals:  BEDAV Beteiligungs GmbH) Leipzig (vormals: Hamburg)";"Rechnungslegung/ Finanzberichte";"» Jahresabschluss zum Geschäftsjahr vom 28.09.2015 bis zum 31.03.2016";"10.07.2017";"95%";"0d747c0b2dd5781887ce3d83356491d9";"c677bb49b197427e";"48713";"Thu Jul  9 00:08:19 2020"
"BE-terna GmbH (vormals: BEDAV GmbH) Leipzig";"Rechnungslegung/ Finanzberichte";"» Jahresabschluss zum Geschäftsjahr vom 01.04.2015 bis zum 31.03.2016";"06.04.2017";"95%";"0d747c0b2dd5781887ce3d83356491d9";"3d3f39a68a8ada5e";"48713";"Thu Jul  9 00:08:19 2020"
"iShares (DE) I Investmentaktiengesellschaft mit Teilgesellschaftsvermögen München";"Rechnungslegung/ Finanzberichte";"» Halbjahresfinanzbericht zum 31. August 2018";"06.11.2018";"10%";"0d747c0b2dd5781887ce3d83356491d9";"5b47e6887c2c9d21";"48713";"Thu Jul  9 00:08:19 2020"
