"Name";"Bereich";"Information";"V.-Datum";"Relevanz";"session.sessionid=";"fts_search_list.selected";"fts_search_list.destHistoryId";"timestamp"
"digatus it group AG München";"Rechnungslegung/ Finanzberichte";"» Jahresabschluss zum Geschäftsjahr vom 01.01.2018 bis zum 31.12.2018";"30.12.2019";"100%";"0d747c0b2dd5781887ce3d83356491d9";"cbc5e892c318987f";"34877";"Wed Jul  8 23:47:44 2020"
"digatus it services GmbH Augsburg";"Rechnungslegung/ Finanzberichte";"» Jahresabschluss zum Geschäftsjahr vom 01.01.2018 bis zum 31.12.2018";"25.11.2019";"100%";"0d747c0b2dd5781887ce3d83356491d9";"66c912d5efdc287c";"34877";"Wed Jul  8 23:47:44 2020"
"digatus it consulting GmbH München";"Rechnungslegung/ Finanzberichte";"» Jahresabschluss zum Geschäftsjahr vom 01.01.2018 bis zum 31.12.2018";"25.11.2019";"100%";"0d747c0b2dd5781887ce3d83356491d9";"b2dc56d9887c15f8";"34877";"Wed Jul  8 23:47:44 2020"
"digatus it consulting GmbH München";"Rechnungslegung/ Finanzberichte";"» Jahresabschluss zum Geschäftsjahr vom 01.01.2017 bis zum 31.12.2017";"16.01.2019";"100%";"0d747c0b2dd5781887ce3d83356491d9";"0e3cb7f41a1394e7";"34877";"Wed Jul  8 23:47:44 2020"
"digatus it group AG München";"Rechnungslegung/ Finanzberichte";"» Jahresabschluss zum Geschäftsjahr vom 01.01.2017 bis zum 31.12.2017";"26.10.2018";"100%";"0d747c0b2dd5781887ce3d83356491d9";"26cb0f7819c3b699";"34877";"Wed Jul  8 23:47:44 2020"
