"Name";"Bereich";"Information";"V.-Datum";"Relevanz";"session.sessionid=";"fts_search_list.selected";"fts_search_list.destHistoryId";"timestamp"
"Gehalt.de GmbH (vormals: PMSG PersonalMarkt Services GmbH) Hamburg";"Rechnungslegung/ Finanzberichte";"» Jahresabschluss zum Geschäftsjahr vom 01.01.2018 bis zum 31.12.2018";"09.04.2020";"100%";"0d747c0b2dd5781887ce3d83356491d9";"16497b3ce29476c4";"54759";"Wed Jul  8 23:38:17 2020"
"BB Beteiligungs GmbH Essen";"Rechnungslegung/ Finanzberichte";"» Offenlegungsbericht  zum 31.12.2018 nach der Verordnung (EU) Nr. 575/2013 i. V. m.
                                          § 26a KWG";"27.04.2020";"50%";"0d747c0b2dd5781887ce3d83356491d9";"b102887422e42501";"54759";"Wed Jul  8 23:38:17 2020"
"iShares (DE) I Investmentaktiengesellschaft mit Teilgesellschaftsvermögen München";"Rechnungslegung/ Finanzberichte";"» Halbjahresfinanzbericht zum 31.08.2019";"16.12.2019";"50%";"0d747c0b2dd5781887ce3d83356491d9";"9c1351c5760c1da6";"54759";"Wed Jul  8 23:38:17 2020"
"Hybrid Raising GmbH Norderfriedrichskoog";"Rechnungslegung/ Finanzberichte";"» Halbjahresfinanzbericht zum 30. Juni 2019";"07.11.2019";"50%";"0d747c0b2dd5781887ce3d83356491d9";"ecc6dab8a46a84b4";"54759";"Wed Jul  8 23:38:17 2020"
"Capital Raising GmbH Norderfriedrichskoog";"Rechnungslegung/ Finanzberichte";"» Halbjahresfinanzbericht zum 30. Juni 2019";"06.11.2019";"50%";"0d747c0b2dd5781887ce3d83356491d9";"00ba19d3937cde3f";"54759";"Wed Jul  8 23:38:17 2020"
"Société Générale Effekten GmbH Frankfurt am Main";"Rechnungslegung/ Finanzberichte";"» Halbjahresfinanzbericht zum 30. Juni 2019";"22.10.2019";"50%";"0d747c0b2dd5781887ce3d83356491d9";"3c8a6b847fe841d1";"54759";"Wed Jul  8 23:38:17 2020"
"LBS-Beteiligungsgesellschaft mbH & Co. KG München";"Rechnungslegung/ Finanzberichte";"» Gesonderter nichtfinanzieller Bericht außerhalb des Lageberichts";"04.10.2019";"50%";"0d747c0b2dd5781887ce3d83356491d9";"d54eac626febfe60";"54759";"Wed Jul  8 23:38:17 2020"
"Merck Financial Services GmbH Darmstadt";"Rechnungslegung/ Finanzberichte";"» Halbjahresfinanzbericht zum 30. Juni 2019";"04.10.2019";"50%";"0d747c0b2dd5781887ce3d83356491d9";"968eea71a8218851";"54759";"Wed Jul  8 23:38:17 2020"
"HT1 Funding GmbH Bad Soden am Taunus";"Rechnungslegung/ Finanzberichte";"» Halbjahresfinanzbericht zum 30. Juni 2019";"05.09.2019";"50%";"0d747c0b2dd5781887ce3d83356491d9";"c6c08cc538146a1a";"54759";"Wed Jul  8 23:38:17 2020"
"DWS Group GmbH & Co. KGaA Frankfurt am Main";"Rechnungslegung/ Finanzberichte";"» Halbjahreskonzernbericht zum 30. Juni 2019";"31.07.2019";"50%";"0d747c0b2dd5781887ce3d83356491d9";"92124750cbeacd6e";"54759";"Wed Jul  8 23:38:17 2020"
"Süd-West-Kreditbank Finanzierung GmbH Bingen am Rhein";"Rechnungslegung/ Finanzberichte";"» Offenlegungsbericht nach CRR zum 31.12.2018";"29.07.2019";"50%";"0d747c0b2dd5781887ce3d83356491d9";"b55813d068ba8e94";"54759";"Wed Jul  8 23:38:17 2020"
"BB Beteiligungs GmbH Essen";"Rechnungslegung/ Finanzberichte";"» Offenlegungsbericht für das Geschäftsjahr vom 01. Januar 2017 bis zum 31. Dezember
                                          2017 nach § 26a KWG i.V.m. der Verordnung (EU) Nr. 575/2013 (CRR) Artikel 435 bis
                                          455";"03.01.2019";"50%";"0d747c0b2dd5781887ce3d83356491d9";"2afc09b6c72cd693";"54759";"Wed Jul  8 23:38:17 2020"
"iShares (DE) I Investmentaktiengesellschaft mit Teilgesellschaftsvermögen München";"Rechnungslegung/ Finanzberichte";"» Halbjahresfinanzbericht zum 31. August 2018";"06.11.2018";"50%";"0d747c0b2dd5781887ce3d83356491d9";"26b504515e1ea81c";"54759";"Wed Jul  8 23:38:17 2020"
"Merck Financial Services GmbH Darmstadt";"Rechnungslegung/ Finanzberichte";"» Halbjahresfinanzberichtzum 30. Juni 2018";"06.11.2018";"50%";"0d747c0b2dd5781887ce3d83356491d9";"c052a1235d6ae0dd";"54759";"Wed Jul  8 23:38:17 2020"
"LBS-Beteiligungsgesellschaft mbH & Co. KG München";"Rechnungslegung/ Finanzberichte";"» Gesonderter nichtfinanzieller Bericht außerhalb des Lageberichts";"11.10.2018";"50%";"0d747c0b2dd5781887ce3d83356491d9";"de033e2e2a518475";"54759";"Wed Jul  8 23:38:17 2020"
"OYAK ANKER Bank GmbH Frankfurt am Main";"Rechnungslegung/ Finanzberichte";"» Offenlegungsbericht nach CRR zum 31.12.2017";"11.10.2018";"50%";"0d747c0b2dd5781887ce3d83356491d9";"65cb24e123d8a027";"54759";"Wed Jul  8 23:38:17 2020"
"Franz Haniel & Cie. GmbH Duisburg-Ruhrort";"Rechnungslegung/ Finanzberichte";"» Halbjahresfinanzbericht zum 30. Juni 2018";"07.09.2018";"50%";"0d747c0b2dd5781887ce3d83356491d9";"c7419d9aa88391ad";"54759";"Wed Jul  8 23:38:17 2020"
"HT1 Funding GmbH Bad Soden am Taunus";"Rechnungslegung/ Finanzberichte";"» Halbjahresfinanzbericht zum 30.06.2018";"03.09.2018";"50%";"0d747c0b2dd5781887ce3d83356491d9";"580dc893be255c25";"54759";"Wed Jul  8 23:38:17 2020"
"DWS Group GmbH & Co. KGaA (vormals: DWS Group SE) Frankfurt am Main";"Rechnungslegung/ Finanzberichte";"» Halbjahresfinanzbericht  zum 30. Juni 2018";"09.08.2018";"50%";"0d747c0b2dd5781887ce3d83356491d9";"16c800a0cf9dd409";"54759";"Wed Jul  8 23:38:17 2020"
"J. Safra Sarasin (Deutschland) GmbH (vormals: Bank J. Safra Sarasin (Deutschland)
                                       AG) Frankfurt am Main";"Rechnungslegung/ Finanzberichte";"» Offenlegungsbericht für das Geschäftsjahr vom 01. Januar 2016 bis zum 31. Dezember
                                          2016 nach Artikel 431 bis 451 CRR";"21.03.2018";"45%";"0d747c0b2dd5781887ce3d83356491d9";"cc427a7f4f7a3e46";"54759";"Wed Jul  8 23:38:17 2020"
