"Name";"Bereich";"Information";"V.-Datum";"Relevanz";"session.sessionid=";"fts_search_list.selected";"fts_search_list.destHistoryId";"timestamp"
"Hesa-Werbung GmbH Paderborn";"Rechnungslegung/ Finanzberichte";"» Jahresabschluss zum Geschäftsjahr vom 01.01.2019 bis zum 31.12.2019";"16.06.2020";"100%";"0d747c0b2dd5781887ce3d83356491d9";"092be65c0457833b";"04715";"Wed Jul  8 23:06:57 2020"
"HESA Solutions GmbH Köln";"Rechnungslegung/ Finanzberichte";"» Jahresabschluss zum Geschäftsjahr vom 01.01.2018 bis zum 31.12.2018";"22.04.2020";"100%";"0d747c0b2dd5781887ce3d83356491d9";"9d5024674532d756";"04715";"Wed Jul  8 23:06:57 2020"
"HESA medica GmbH Gronau";"Rechnungslegung/ Finanzberichte";"» Jahresabschluss zum Geschäftsjahr vom 01.01.2020 bis zum 23.01.2020 und Liquidationsschlussbilanz";"09.04.2020";"100%";"0d747c0b2dd5781887ce3d83356491d9";"ba41f173cd1a1b6e";"04715";"Wed Jul  8 23:06:57 2020"
"HESA-Flüssiggas und technische Gase-Vertriebs GmbH Brandenburg an der Havel";"Rechnungslegung/ Finanzberichte";"» Jahresabschluss zum Geschäftsjahr vom 01.01.2018 bis zum 31.12.2018";"09.03.2020";"100%";"0d747c0b2dd5781887ce3d83356491d9";"bef2046f7b69361d";"04715";"Wed Jul  8 23:06:57 2020"
"hesa Heist GmbH & Co. KG Breuberg";"Rechnungslegung/ Finanzberichte";"» Jahresabschluss zum Geschäftsjahr vom 01.01.2018 bis zum 31.12.2018";"03.02.2020";"100%";"0d747c0b2dd5781887ce3d83356491d9";"8413f7e6300b3c8f";"04715";"Wed Jul  8 23:06:57 2020"
"HESA Kunststofftechnik GmbH & Co. KG Horb am Neckar";"Rechnungslegung/ Finanzberichte";"» Jahresabschluss zum Geschäftsjahr vom 01.01.2018 bis zum 31.12.2018";"31.01.2020";"100%";"0d747c0b2dd5781887ce3d83356491d9";"45f93625409b8e90";"04715";"Wed Jul  8 23:06:57 2020"
"plusdrei HESA GmbH Ostfildern";"Rechnungslegung/ Finanzberichte";"» Jahresabschluss zum Geschäftsjahr vom 01.01.2018 bis zum 31.12.2018";"30.01.2020";"100%";"0d747c0b2dd5781887ce3d83356491d9";"0270f74686ebeef8";"04715";"Wed Jul  8 23:06:57 2020"
"HESA Heizung,  Sanitär und Klimatechnik GmbH Deesbach";"Rechnungslegung/ Finanzberichte";"» Jahresabschluss zum Geschäftsjahr vom 01.01.2018 bis zum 31.12.2018";"28.01.2020";"100%";"0d747c0b2dd5781887ce3d83356491d9";"7605aee68732c9f5";"04715";"Wed Jul  8 23:06:57 2020"
"Hesa-Werbung GmbH Paderborn";"Rechnungslegung/ Finanzberichte";"» Jahresabschluss zum Geschäftsjahr vom 01.01.2018 bis zum 31.12.2018";"17.01.2020";"100%";"0d747c0b2dd5781887ce3d83356491d9";"e7d5afe63f3acd8d";"04715";"Wed Jul  8 23:06:57 2020"
"HESA Installationstechnik GmbH Magdeburg";"Rechnungslegung/ Finanzberichte";"» Jahresabschluss zum Geschäftsjahr vom 01.01.2018 bis zum 31.12.2018";"10.01.2020";"100%";"0d747c0b2dd5781887ce3d83356491d9";"435db3958ba351da";"04715";"Wed Jul  8 23:06:57 2020"
"HESA Gebäudeausrüstung Gesellschaft mit beschränkter Haftung Eisenberg";"Rechnungslegung/ Finanzberichte";"» Jahresabschluss zum Geschäftsjahr vom 01.01.2018 bis zum 31.12.2018";"18.12.2019";"100%";"0d747c0b2dd5781887ce3d83356491d9";"7747aef94e2f0117";"04715";"Wed Jul  8 23:06:57 2020"
"JULIWA-HESA GmbH Heidelberg";"Rechnungslegung/ Finanzberichte";"» Jahresabschluss zum Geschäftsjahr vom 01.01.2018 bis zum 31.12.2018";"16.07.2019";"100%";"0d747c0b2dd5781887ce3d83356491d9";"deb5dc4acb89c0aa";"04715";"Wed Jul  8 23:06:57 2020"
"HESA-Flüssiggas und technische Gase-Vertriebs GmbH Brandenburg an der Havel";"Rechnungslegung/ Finanzberichte";"» Jahresabschluss zum Geschäftsjahr vom 01.01.2017 bis zum 31.12.2017";"12.03.2019";"100%";"0d747c0b2dd5781887ce3d83356491d9";"382a6ea7c3b39723";"04715";"Wed Jul  8 23:06:57 2020"
"HESA Installationstechnik GmbH Magdeburg";"Rechnungslegung/ Finanzberichte";"» Jahresabschluss zum Geschäftsjahr vom 01.01.2017 bis zum 31.12.2017";"15.02.2019";"100%";"0d747c0b2dd5781887ce3d83356491d9";"8f39747b55b7ca58";"04715";"Wed Jul  8 23:06:57 2020"
"hesa Heist GmbH & Co. KG Breuberg";"Rechnungslegung/ Finanzberichte";"» Jahresabschluss zum Geschäftsjahr vom 01.01.2017 bis zum 31.12.2017";"29.01.2019";"100%";"0d747c0b2dd5781887ce3d83356491d9";"e9f55017b95a570c";"04715";"Wed Jul  8 23:06:57 2020"
"Hesa-Werbung GmbH Paderborn";"Rechnungslegung/ Finanzberichte";"» Jahresabschluss zum Geschäftsjahr vom 01.01.2017 bis zum 31.12.2017";"11.01.2019";"100%";"0d747c0b2dd5781887ce3d83356491d9";"c7f1f04447ce96bd";"04715";"Wed Jul  8 23:06:57 2020"
"Hesa Bau GmbH Greifswald";"Rechnungslegung/ Finanzberichte";"» Jahresabschluss zum Geschäftsjahr vom 01.01.2017 bis zum 31.12.2017";"09.01.2019";"100%";"0d747c0b2dd5781887ce3d83356491d9";"b3094ecc71773d4a";"04715";"Wed Jul  8 23:06:57 2020"
"plusdrei HESA GmbH Ostfildern";"Rechnungslegung/ Finanzberichte";"» Jahresabschluss zum Geschäftsjahr vom 01.01.2017 bis zum 31.12.2017";"03.01.2019";"100%";"0d747c0b2dd5781887ce3d83356491d9";"74d3d07592148ef2";"04715";"Wed Jul  8 23:06:57 2020"
"HESA Gebäudeausrüstung Gesellschaft mit beschränkter Haftung Eisenberg";"Rechnungslegung/ Finanzberichte";"» Jahresabschluss zum Geschäftsjahr vom 01.01.2017 bis zum 31.12.2017";"07.11.2018";"100%";"0d747c0b2dd5781887ce3d83356491d9";"9e14580abfae1528";"04715";"Wed Jul  8 23:06:57 2020"
"JULIWA-HESA GmbH Heidelberg";"Rechnungslegung/ Finanzberichte";"» Jahresabschluss zum Geschäftsjahr vom 01.01.2017 bis zum 31.12.2017";"27.06.2018";"83%";"0d747c0b2dd5781887ce3d83356491d9";"9617eafd0194606a";"04715";"Wed Jul  8 23:06:57 2020"
