"Name";"Bereich";"Information";"V.-Datum";"Relevanz";"session.sessionid=";"fts_search_list.selected";"fts_search_list.destHistoryId";"timestamp"
"IBW Industriebeteiligungen Worms GmbH & Co. KG Worms";"Rechnungslegung/ Finanzberichte";"» Jahresabschluss zum Geschäftsjahr vom 01.01.2019 bis zum 31.12.2019";"24.06.2020";"100%";"0d747c0b2dd5781887ce3d83356491d9";"f6fb77b6dbba65ae";"59523";"Wed Jul  8 23:20:55 2020"
"ibW Rührwerkstechnik GmbH Althengstett";"Rechnungslegung/ Finanzberichte";"» Jahresabschluss zum Geschäftsjahr vom 01.01.2019 bis zum 31.12.2019";"20.05.2020";"100%";"0d747c0b2dd5781887ce3d83356491d9";"8217c38dc20e4ccf";"59523";"Wed Jul  8 23:20:55 2020"
"bmh-ibw architekten- und ingenieur GmbH Berlin";"Rechnungslegung/ Finanzberichte";"» Jahresabschluss zum Geschäftsjahr vom 01.01.2018 bis zum 31.12.2018";"26.03.2020";"100%";"0d747c0b2dd5781887ce3d83356491d9";"b5ab3746ba33c891";"59523";"Wed Jul  8 23:20:55 2020"
"IBW van Almelo GmbH Itterbeck";"Rechnungslegung/ Finanzberichte";"» Jahresabschluss zum Geschäftsjahr vom 01.01.2018 bis zum 31.12.2018";"03.03.2020";"100%";"0d747c0b2dd5781887ce3d83356491d9";"78e5241e43cc41b6";"59523";"Wed Jul  8 23:20:55 2020"
"IBW Ventures GmbH & Co. KG Dresden";"Rechnungslegung/ Finanzberichte";"» Jahresabschluss zum Geschäftsjahr vom 01.01.2018 bis zum 31.12.2018";"14.02.2020";"100%";"0d747c0b2dd5781887ce3d83356491d9";"64796d1589ecc0c4";"59523";"Wed Jul  8 23:20:55 2020"
"IBW Innovation Bildung Wiesbaden GmbH Wiesbaden";"Rechnungslegung/ Finanzberichte";"» Jahresabschluss zum Geschäftsjahr vom 01.01.2018 bis zum 31.12.2018";"11.02.2020";"100%";"0d747c0b2dd5781887ce3d83356491d9";"d7c763cd66bb9969";"59523";"Wed Jul  8 23:20:55 2020"
"ibW Rührwerkstechnik GmbH Althengstett";"Rechnungslegung/ Finanzberichte";"» Jahresabschluss zum Geschäftsjahr vom 01.01.2018 bis zum 31.12.2018";"16.01.2020";"100%";"0d747c0b2dd5781887ce3d83356491d9";"17a83445f3471837";"59523";"Wed Jul  8 23:20:55 2020"
"IBW GmbH Kronach";"Rechnungslegung/ Finanzberichte";"» Jahresabschluss zum Geschäftsjahr vom 01.01.2018 bis zum 31.12.2018";"22.11.2019";"100%";"0d747c0b2dd5781887ce3d83356491d9";"d1a0d5bd447cc4a2";"59523";"Wed Jul  8 23:20:55 2020"
"IBW Ingenieurbüro für Bauwesen und Wasserwirtschaft GmbH Gera";"Rechnungslegung/ Finanzberichte";"» Jahresabschluss zum Geschäftsjahr vom 01.01.2018 bis zum 31.12.2018";"19.11.2019";"100%";"0d747c0b2dd5781887ce3d83356491d9";"6caeb3fb46c9ac15";"59523";"Wed Jul  8 23:20:55 2020"
"ibw Gesellschaft für innovatives Bauen und Wohnen mbH Esslingen am Neckar";"Rechnungslegung/ Finanzberichte";"» Jahresabschluss zum Geschäftsjahr vom 01.01.2018 bis zum 31.12.2018";"10.09.2019";"100%";"0d747c0b2dd5781887ce3d83356491d9";"073af72cd3e7e995";"59523";"Wed Jul  8 23:20:55 2020"
"IBW Lager- und Fördertechnik GmbH Waldeck";"Rechnungslegung/ Finanzberichte";"» Jahresabschluss zum Geschäftsjahr vom 01.01.2018 bis zum 31.12.2018";"06.09.2019";"100%";"0d747c0b2dd5781887ce3d83356491d9";"240e7ecc7926bc82";"59523";"Wed Jul  8 23:20:55 2020"
"IBW Industriebeteiligungen Worms GmbH & Co. KG Worms";"Rechnungslegung/ Finanzberichte";"» Jahresabschluss zum Geschäftsjahr vom 01.01.2018 bis zum 31.12.2018";"05.09.2019";"100%";"0d747c0b2dd5781887ce3d83356491d9";"40d3a4318bf272c6";"59523";"Wed Jul  8 23:20:55 2020"
"IBW Baustoffe GmbH Datteln";"Rechnungslegung/ Finanzberichte";"» Jahresabschluss zum Geschäftsjahr vom 01.01.2018 bis zum 31.12.2018";"09.07.2019";"100%";"0d747c0b2dd5781887ce3d83356491d9";"f44c6d2570acc0c7";"59523";"Wed Jul  8 23:20:55 2020"
"IBW Baugesellschaft mbH Pritzwalk";"Rechnungslegung/ Finanzberichte";"» Jahresabschluss zum Geschäftsjahr vom 01.01.2018 bis zum 31.12.2018";"08.07.2019";"100%";"0d747c0b2dd5781887ce3d83356491d9";"5574ae264ceffa0f";"59523";"Wed Jul  8 23:20:55 2020"
"IBW Ideal Befestigungstechnik Winterberg Vertriebs-GmbH Winterberg";"Rechnungslegung/ Finanzberichte";"» Jahresabschluss zum Geschäftsjahr vom 01.01.2018 bis zum 31.12.2018";"03.07.2019";"100%";"0d747c0b2dd5781887ce3d83356491d9";"9d22dc097d8d250e";"59523";"Wed Jul  8 23:20:55 2020"
"IBW GmbH Kronach";"Rechnungslegung/ Finanzberichte";"» Jahresabschluss zum Geschäftsjahr vom 01.01.2017 bis zum 31.12.2017";"03.06.2019";"100%";"0d747c0b2dd5781887ce3d83356491d9";"6f43af837e47cc3c";"59523";"Wed Jul  8 23:20:55 2020"
"bmh-ibw architekten- und ingenieur GmbH Berlin";"Rechnungslegung/ Finanzberichte";"» Jahresabschluss zum Geschäftsjahr vom 01.01.2017 bis zum 31.12.2017";"29.03.2019";"100%";"0d747c0b2dd5781887ce3d83356491d9";"3a3df3d52acfa0b3";"59523";"Wed Jul  8 23:20:55 2020"
"IBW Ingenieur-Büro Woitzel GmbH Ibbenbüren";"Rechnungslegung/ Finanzberichte";"» Jahresabschluss zum Geschäftsjahr vom 01.01.2016 bis zum 31.12.2016 Berichtigung der Veröffentlichung vom 04.01.2018";"08.03.2019";"100%";"0d747c0b2dd5781887ce3d83356491d9";"7545d2337a0c199c";"59523";"Wed Jul  8 23:20:55 2020"
"IBW Ventures GmbH & Co. KG Dresden";"Rechnungslegung/ Finanzberichte";"» Jahresabschluss zum Geschäftsjahr vom 01.01.2017 bis zum 31.12.2017";"30.01.2019";"100%";"0d747c0b2dd5781887ce3d83356491d9";"d822ed1735e1b6e3";"59523";"Wed Jul  8 23:20:55 2020"
"IBW Ideal Befestigungstechnik Winterberg Vertriebs-GmbH Winterberg";"Rechnungslegung/ Finanzberichte";"» Jahresabschluss zum Geschäftsjahr vom 01.01.2017 bis zum 31.12.2017";"06.12.2018";"100%";"0d747c0b2dd5781887ce3d83356491d9";"bf435d9d281461db";"59523";"Wed Jul  8 23:20:55 2020"
