"Name";"Bereich";"Information";"V.-Datum";"Relevanz";"session.sessionid=";"fts_search_list.selected";"fts_search_list.destHistoryId";"timestamp"
"""IfBm Konzept GmbH"" (vormals: Institut für Bildungsmanagement Nausitz GmbH) Erfurt (vormals: Artern)";"Rechnungslegung/ Finanzberichte";"» Jahresabschluss zum Geschäftsjahr vom 01.01.2011 bis zum 31.12.2011";"07.02.2013";"92%";"0d747c0b2dd5781887ce3d83356491d9";"b9c2083c32b88c69";"42974";"Wed Jul  8 22:25:44 2020"
"IF KonzeptE AG Braunschweig";"Rechnungslegung/ Finanzberichte";"» Jahresabschluss zum Geschäftsjahr vom 01.01.2011 bis zum 31.12.2011";"16.01.2013";"92%";"0d747c0b2dd5781887ce3d83356491d9";"89af9b8ee05bc05e";"42974";"Wed Jul  8 22:25:44 2020"
"IF KonzeptE AG Braunschweig";"Rechnungslegung/ Finanzberichte";"» Jahresabschluss zum Geschäftsjahr vom 01.01.2010 bis zum 31.12.2010";"10.04.2012";"92%";"0d747c0b2dd5781887ce3d83356491d9";"181346949a7b6738";"42974";"Wed Jul  8 22:25:44 2020"
"IF KonzeptE AG (vormals: Kanzlei COPA AG) Braunschweig (vormals: Crimmitschau)";"Rechnungslegung/ Finanzberichte";"» Jahresabschluss zum Geschäftsjahr vom 01.01.2009 bis zum 31.12.2009";"09.11.2011";"92%";"0d747c0b2dd5781887ce3d83356491d9";"10052820347f991a";"42974";"Wed Jul  8 22:25:44 2020"
"Franz Haniel & Cie. GmbH Duisburg-Ruhrort";"Rechnungslegung/ Finanzberichte";"» Halbjahresfinanzbericht zum 30. Juni 2018";"07.09.2018";"17%";"0d747c0b2dd5781887ce3d83356491d9";"8f3a5bd686b9abf9";"42974";"Wed Jul  8 22:25:44 2020"
