"Name";"Bereich";"Information";"V.-Datum";"Relevanz";"session.sessionid=";"fts_search_list.selected";"fts_search_list.destHistoryId";"timestamp"
"Montage Master GmbH Emsbüren";"Rechnungslegung/ Finanzberichte";"» Jahresabschluss zum Geschäftsjahr vom 01.01.2019 bis zum 31.12.2019";"18.06.2020";"100%";"0d747c0b2dd5781887ce3d83356491d9";"a98e399f946262ae";"85452";"Wed Jul  8 23:06:13 2020"
"Montage Master GmbH Emsbüren (vormals: Lingen (Ems))";"Rechnungslegung/ Finanzberichte";"» Jahresabschluss zum Geschäftsjahr vom 01.01.2018 bis zum 31.12.2018";"09.03.2020";"100%";"0d747c0b2dd5781887ce3d83356491d9";"7a8fad98965fa7f5";"85452";"Wed Jul  8 23:06:13 2020"
"DMG MORI AKTIENGESELLSCHAFT Bielefeld";"Rechnungslegung/ Finanzberichte";"» Gesonderter nichtfinanzieller Bericht außerhalb des Lageberichts";"15.04.2020";"10%";"0d747c0b2dd5781887ce3d83356491d9";"bc6eaf7e13364f8e";"85452";"Wed Jul  8 23:06:13 2020"
"MAX Automation SE Düsseldorf";"Rechnungslegung/ Finanzberichte";"» Gesonderter nichtfinanzieller Bericht außerhalb des Lageberichts";"23.03.2020";"10%";"0d747c0b2dd5781887ce3d83356491d9";"35397976c3e3a640";"85452";"Wed Jul  8 23:06:13 2020"
"Kreissparkasse Düsseldorf Düsseldorf";"Rechnungslegung/ Finanzberichte";"» Gesonderter nichtfinanzieller Bericht außerhalb des Lageberichts";"15.08.2019";"10%";"0d747c0b2dd5781887ce3d83356491d9";"0cd28b5286dcd00b";"85452";"Wed Jul  8 23:06:13 2020"
"ThyssenKrupp AG Duisburg und Essen";"Rechnungslegung/ Finanzberichte";"» Zwischenbericht 9 Monate 2008/2009 - 01. Oktober 2008 - 30. Juni 2009";"14.08.2009";"5%";"0d747c0b2dd5781887ce3d83356491d9";"111b4585911f65cc";"85452";"Wed Jul  8 23:06:13 2020"
