"Name";"Bereich";"Information";"V.-Datum";"Relevanz";"session.sessionid=";"fts_search_list.selected";"fts_search_list.destHistoryId";"timestamp"
"Panaya GmbH Ismaning (vormals: München)";"Rechnungslegung/ Finanzberichte";"» Jahresabschluss zum Geschäftsjahr vom 01.01.2019 bis zum 31.12.2019";"07.04.2020";"100%";"0d747c0b2dd5781887ce3d83356491d9";"4b3aa6bc2b495f7f";"17193";"Wed Jul  8 23:55:34 2020"
"Panaya GmbH Ismaning (vormals: München)";"Rechnungslegung/ Finanzberichte";"» Jahresabschluss zum Geschäftsjahr vom 01.01.2018 bis zum 31.12.2018";"24.06.2019";"100%";"0d747c0b2dd5781887ce3d83356491d9";"e3da150ddfd0b581";"17193";"Wed Jul  8 23:55:34 2020"
"Panaya GmbH München (vormals: Frankfurt am Main)";"Rechnungslegung/ Finanzberichte";"» Jahresabschluss zum Geschäftsjahr vom 01.01.2017 bis zum 31.12.2017";"16.04.2018";"92%";"0d747c0b2dd5781887ce3d83356491d9";"ac10f9f0d09b1a62";"17193";"Wed Jul  8 23:55:34 2020"
"Panaya GmbH München (vormals: Frankfurt am Main)";"Rechnungslegung/ Finanzberichte";"» Jahresabschluss zum Geschäftsjahr vom 01.01.2015 bis zum 31.12.2015 Ergänzung der Veröffentlichung vom 16.11.2016";"06.07.2017";"92%";"0d747c0b2dd5781887ce3d83356491d9";"4327e642af640487";"17193";"Wed Jul  8 23:55:34 2020"
"Panaya GmbH Frankfurt am Main";"Rechnungslegung/ Finanzberichte";"» Jahresabschluss zum Geschäftsjahr vom 01.01.2016 bis zum 31.12.2016";"21.06.2017";"92%";"0d747c0b2dd5781887ce3d83356491d9";"413239f2a3669473";"17193";"Wed Jul  8 23:55:34 2020"
"Panaya GmbH Frankfurt am Main (vormals: Karlsruhe)";"Rechnungslegung/ Finanzberichte";"» Jahresabschluss zum Geschäftsjahr vom 01.01.2015 bis zum 31.12.2015 Ergänzt am 06.07.2017";"16.11.2016";"92%";"0d747c0b2dd5781887ce3d83356491d9";"59c4bf5b612de825";"17193";"Wed Jul  8 23:55:34 2020"
"Panaya GmbH Karlsruhe";"Rechnungslegung/ Finanzberichte";"» Jahresabschluss zum Geschäftsjahr vom 01.01.2014 bis zum 31.12.2014";"14.07.2015";"92%";"0d747c0b2dd5781887ce3d83356491d9";"676d22466a9bc6d9";"17193";"Wed Jul  8 23:55:34 2020"
"Panaya GmbH Karlsruhe (vormals: Frankfurt am Main)";"Rechnungslegung/ Finanzberichte";"» Jahresabschluss zum Geschäftsjahr vom 01.01.2013 bis zum 31.12.2013";"24.11.2014";"92%";"0d747c0b2dd5781887ce3d83356491d9";"0932e82b14906686";"17193";"Wed Jul  8 23:55:34 2020"
