"Name";"Bereich";"Information";"V.-Datum";"Relevanz";"session.sessionid=";"fts_search_list.selected";"fts_search_list.destHistoryId";"timestamp"
"Solevo GmbH Hamburg (vormals: Göppingen)";"Rechnungslegung/ Finanzberichte";"» Jahresabschluss zum Geschäftsjahr vom 01.01.2014 bis zum 31.12.2014";"29.02.2016";"92%";"0d747c0b2dd5781887ce3d83356491d9";"8fee0d2a7ba5e29d";"72931";"Wed Jul  8 23:50:36 2020"
"Solevo GmbH Göppingen";"Rechnungslegung/ Finanzberichte";"» Jahresabschluss zum Geschäftsjahr vom 01.01.2013 bis zum 31.12.2013";"03.06.2014";"92%";"0d747c0b2dd5781887ce3d83356491d9";"5b11efe32701bad1";"72931";"Wed Jul  8 23:50:36 2020"
"Solevo GmbH Göppingen";"Rechnungslegung/ Finanzberichte";"» Jahresabschluss zum Geschäftsjahr vom 01.01.2012 bis zum 31.12.2012";"02.12.2013";"92%";"0d747c0b2dd5781887ce3d83356491d9";"7e9a3d27eef06db6";"72931";"Wed Jul  8 23:50:36 2020"
"Solevo GmbH (vormals: Valueplus GmbH) Göppingen";"Rechnungslegung/ Finanzberichte";"» Jahresabschluss zum Geschäftsjahr vom 01.01.2011 bis zum 31.12.2011";"10.12.2012";"92%";"0d747c0b2dd5781887ce3d83356491d9";"0c5229998b3cf93e";"72931";"Wed Jul  8 23:50:36 2020"
"Solevo GmbH Göppingen (vormals: Hamburg)";"Rechnungslegung/ Finanzberichte";"» Jahresabschluss zum Geschäftsjahr vom 01.01.2010 bis zum 31.12.2010";"30.12.2011";"92%";"0d747c0b2dd5781887ce3d83356491d9";"ee5ec74aea33ccca";"72931";"Wed Jul  8 23:50:36 2020"
"Solevo GmbH (vormals: TotalCall GmbH) Göppingen";"Rechnungslegung/ Finanzberichte";"» Jahresabschluss zum Geschäftsjahr vom 01.01.2008 bis zum 31.12.2008";"22.08.2011";"92%";"0d747c0b2dd5781887ce3d83356491d9";"6debe7d4ec064709";"72931";"Wed Jul  8 23:50:36 2020"
"Solevo GmbH (vormals: TotalCall GmbH) Göppingen";"Rechnungslegung/ Finanzberichte";"» Jahresabschluss zum Geschäftsjahr vom 01.01.2009 bis zum 31.12.2009";"16.08.2011";"92%";"0d747c0b2dd5781887ce3d83356491d9";"6843589cfb5bb30e";"72931";"Wed Jul  8 23:50:36 2020"
