"Name";"Bereich";"Information";"V.-Datum";"Relevanz";"session.sessionid=";"fts_search_list.selected";"fts_search_list.destHistoryId";"timestamp"
"Staufen-Steuerberatungsgesellschaft m.b.H. Göppingen";"Rechnungslegung/ Finanzberichte";"» Jahresabschluss zum Geschäftsjahr vom 01.07.2018 bis zum 30.06.2019";"01.07.2020";"100%";"0d747c0b2dd5781887ce3d83356491d9";"49de6d977fa1bb1f";"31471";"Wed Jul  8 22:30:29 2020"
"Staufen. Consulting GmbH Köngen";"Rechnungslegung/ Finanzberichte";"» Jahresabschluss zum Geschäftsjahr vom 01.01.2019 bis zum 31.12.2019";"01.07.2020";"100%";"0d747c0b2dd5781887ce3d83356491d9";"21b6014139ab23af";"31471";"Wed Jul  8 22:30:29 2020"
"Automobile Stauf Süd GmbH Neumarkt i.d.OPf.";"Rechnungslegung/ Finanzberichte";"» Jahresabschluss zum Geschäftsjahr vom 01.01.2019 bis zum 31.12.2019";"29.06.2020";"100%";"0d747c0b2dd5781887ce3d83356491d9";"fef2971bd5481223";"31471";"Wed Jul  8 22:30:29 2020"
"Staufer Textilpflege GmbH München";"Rechnungslegung/ Finanzberichte";"» Jahresabschluss zum Geschäftsjahr vom 01.01.2018 bis zum 31.12.2018";"26.06.2020";"100%";"0d747c0b2dd5781887ce3d83356491d9";"d68929edf48dfad1";"31471";"Wed Jul  8 22:30:29 2020"
"Staufen Feinmechanik GmbH Albershausen";"Rechnungslegung/ Finanzberichte";"» Jahresabschluss zum Geschäftsjahr vom 01.01.2019 bis zum 31.12.2019";"26.06.2020";"100%";"0d747c0b2dd5781887ce3d83356491d9";"b022179c309c5b42";"31471";"Wed Jul  8 22:30:29 2020"
"AVS Autovermietung Staufen GmbH Göppingen";"Rechnungslegung/ Finanzberichte";"» Jahresabschluss zum Geschäftsjahr vom 01.01.2019 bis zum 31.12.2019";"25.06.2020";"100%";"0d747c0b2dd5781887ce3d83356491d9";"1ea6ed6264a0d8f9";"31471";"Wed Jul  8 22:30:29 2020"
"Staufen Trucks GmbH Schlierbach";"Rechnungslegung/ Finanzberichte";"» Jahresabschluss zum Geschäftsjahr vom 01.01.2018 bis zum 31.12.2018";"15.06.2020";"100%";"0d747c0b2dd5781887ce3d83356491d9";"105a333dc8bb715e";"31471";"Wed Jul  8 22:30:29 2020"
"Staufen Baumaschinen GmbH Eislingen";"Rechnungslegung/ Finanzberichte";"» Jahresabschluss zum Geschäftsjahr vom 01.01.2019 bis zum 31.12.2019";"03.06.2020";"100%";"0d747c0b2dd5781887ce3d83356491d9";"33a2722d7623298b";"31471";"Wed Jul  8 22:30:29 2020"
"Staufen Bauträger & Marketing GmbH Bad Reichenhall";"Rechnungslegung/ Finanzberichte";"» Liquidationseröffnungsbilanz zum 01.10.2019";"31.03.2020";"100%";"0d747c0b2dd5781887ce3d83356491d9";"70377a6f4acd6358";"31471";"Wed Jul  8 22:30:29 2020"
"AMS Asphaltmischwerk Staufen GmbH & Co. KG Schwäbisch Gmünd";"Rechnungslegung/ Finanzberichte";"» Jahresabschluss zum Geschäftsjahr vom 01.01.2018 bis zum 31.12.2018";"20.03.2020";"100%";"0d747c0b2dd5781887ce3d83356491d9";"513d800f4563974b";"31471";"Wed Jul  8 22:30:29 2020"
"Stauf Klebstoffwerk Gesellschaft mit beschränkter Haftung Wilnsdorf";"Rechnungslegung/ Finanzberichte";"» Jahresabschluss zum Geschäftsjahr vom 01.01.2018 bis zum 31.12.2018";"18.03.2020";"100%";"0d747c0b2dd5781887ce3d83356491d9";"515a40fad8063a51";"31471";"Wed Jul  8 22:30:29 2020"
"AVS Autovermietung Staufen GmbH Göppingen";"Rechnungslegung/ Finanzberichte";"» Jahresabschluss zum Geschäftsjahr vom 01.01.2018 bis zum 31.12.2018 Berichtigung der Veröffentlichung vom 16.05.2019";"12.03.2020";"100%";"0d747c0b2dd5781887ce3d83356491d9";"64dcbbe2bfd92fc0";"31471";"Wed Jul  8 22:30:29 2020"
"Staufen GmbH & Co KG Ainring";"Rechnungslegung/ Finanzberichte";"» Jahresabschluss zum Geschäftsjahr vom 01.01.2018 bis zum 31.12.2018";"02.03.2020";"100%";"0d747c0b2dd5781887ce3d83356491d9";"3af1c63054c63bec";"31471";"Wed Jul  8 22:30:29 2020"
"Staufen.AG Beratung Akademie Beteiligung Köngen";"Rechnungslegung/ Finanzberichte";"» Jahresabschluss zum Geschäftsjahr vom 01.01.2018 bis zum 31.12.2018";"25.02.2020";"100%";"0d747c0b2dd5781887ce3d83356491d9";"0359e5a588ecb873";"31471";"Wed Jul  8 22:30:29 2020"
"Staufen Premium GmbH Wurmlingen";"Rechnungslegung/ Finanzberichte";"» Jahresabschluss zum Geschäftsjahr vom 25.04.2018 bis zum 31.12.2018";"19.02.2020";"100%";"0d747c0b2dd5781887ce3d83356491d9";"ca8c4b9fde7869df";"31471";"Wed Jul  8 22:30:29 2020"
"Staufen Baumaschinen GmbH Eislingen";"Rechnungslegung/ Finanzberichte";"» Jahresabschluss zum Geschäftsjahr vom 01.01.2018 bis zum 31.12.2018";"17.02.2020";"100%";"0d747c0b2dd5781887ce3d83356491d9";"9d5dc57f1e7f1eff";"31471";"Wed Jul  8 22:30:29 2020"
"Asphaltmischwerk Staufen Verwaltungs-GmbH Schwäbisch Gmünd";"Rechnungslegung/ Finanzberichte";"» Jahresabschluss zum Geschäftsjahr vom 01.01.2018 bis zum 31.12.2018";"17.02.2020";"100%";"0d747c0b2dd5781887ce3d83356491d9";"108b23d79ad7073f";"31471";"Wed Jul  8 22:30:29 2020"
"STAUFEN ENGINEERING GmbH Automation und Produktentwicklung Donzdorf";"Rechnungslegung/ Finanzberichte";"» Jahresabschluss zum Geschäftsjahr vom 01.01.2018 bis zum 31.12.2018";"14.02.2020";"100%";"0d747c0b2dd5781887ce3d83356491d9";"f1bbd1603daee323";"31471";"Wed Jul  8 22:30:29 2020"
"Staufen-Kanzlei Steinacher + Heinz Steuerberatungsgesellschaft mbH Oberstaufen";"Rechnungslegung/ Finanzberichte";"» Jahresabschluss zum Geschäftsjahr vom 01.02.2018 bis zum 31.01.2019";"07.02.2020";"100%";"0d747c0b2dd5781887ce3d83356491d9";"1ac34397b6b69fc3";"31471";"Wed Jul  8 22:30:29 2020"
"Staufen. Consulting GmbH Köngen";"Rechnungslegung/ Finanzberichte";"» Jahresabschluss zum Geschäftsjahr vom 01.01.2018 bis zum 31.12.2018";"07.02.2020";"100%";"0d747c0b2dd5781887ce3d83356491d9";"c38043d984594ff4";"31471";"Wed Jul  8 22:30:29 2020"
