"Name";"Bereich";"Information";"V.-Datum";"Relevanz";"session.sessionid=";"fts_search_list.selected";"fts_search_list.destHistoryId";"timestamp"
"teSi System GmbH Blankenbach";"Rechnungslegung/ Finanzberichte";"» Jahresabschluss zum Geschäftsjahr vom 01.01.2018 bis zum 31.12.2018";"04.02.2020";"100%";"0d747c0b2dd5781887ce3d83356491d9";"bd921f298798a360";"49949";"Wed Jul  8 23:22:44 2020"
"teSi System GmbH (vormals: TC CleanSystem verbesserte Rahmenbedingungen im modernen
                                       Büro GmbH) Blankenbach";"Rechnungslegung/ Finanzberichte";"» Jahresabschluss zum Geschäftsjahr vom 01.01.2017 bis zum 31.12.2017";"24.01.2019";"100%";"0d747c0b2dd5781887ce3d83356491d9";"a4d87f2cf246ce32";"49949";"Wed Jul  8 23:22:44 2020"
"teSi System GmbH (vormals: TC CleanSystem verbesserte Rahmenbedingungen im modernen
                                       Büro GmbH) Blankenbach";"Rechnungslegung/ Finanzberichte";"» Jahresabschluss zum Geschäftsjahr vom 01.01.2016 bis zum 31.12.2016";"26.01.2018";"95%";"0d747c0b2dd5781887ce3d83356491d9";"753360b7fdcafc55";"49949";"Wed Jul  8 23:22:44 2020"
