"Name";"Bereich";"Information";"V.-Datum";"Relevanz";"session.sessionid=";"fts_search_list.selected";"fts_search_list.destHistoryId";"timestamp"
"ADAC Autovermietung GmbH (München),  ADAC Camping GmbH (München),  ADAC Finanzdienste GmbH (München),  ADAC HEMS und Fachkräfte GmbH (München),  ADAC IT Service GmbH (München),  ADAC Medien und Reise GmbH (München),  ADAC Service GmbH (München),  Aero-Dienst GmbH (Nürnberg),  Dienstleistungs-Center Halle GmbH (DLC Halle) (Halle (Saale)),  GKS Gesellschaft für Kommunikationsservice mbH (Passau) München";"Rechnungslegung/ Finanzberichte";"» §§ 264 Abs. 3, 264b HGB zum Geschäftsjahr vom 01.01.2019 bis zum 31.12.2019 ADAC SE (München)";"11.03.2020";"100%";"ab583ff6c10622297060f807c76c00aa";"e698e8f583b8947d";"81879";"Wed Jul  8 23:02:58 2020"
"ADAC Autovermietung GmbH (München),  ADAC Camping GmbH (München),  ADAC Finanzdienste GmbH (München),  ADAC HEMS Academy GmbH (Sankt Augustin),  ADAC HEMS und Fachkräfte GmbH (München),  ADAC IT Service GmbH (München),  ADAC Medien und Reise GmbH (München),  ADAC Service GmbH (München),  Aero-Dienst GmbH (Nürnberg),  Dienstleistungs-Center Halle GmbH (DLC Halle) (Halle (Saale)),  GKS Gesellschaft für Kommunikationsservice mbH (Passau) München";"Rechnungslegung/ Finanzberichte";"» §§ 264 Abs. 3, 264b HGB zum Geschäftsjahr vom 01.01.2018 bis zum 31.12.2018 ADAC SE (München)";"20.02.2019";"100%";"ab583ff6c10622297060f807c76c00aa";"e6af7fc2b50d6297";"81879";"Wed Jul  8 23:02:58 2020"
"ADAC SE München";"» Konzernabschluss zum Geschäftsjahr vom 01.01.2018 bis zum 31.12.2018";"19.11.2019";"ab583ff6c10622297060f807c76c00aa";"e6af7fc2b50d6297";"81879";"Wed Jul  8 23:02:58 2020";"";""
"ADAC SE München";"Rechnungslegung/ Finanzberichte";"» Konzernabschluss zum Geschäftsjahr vom 01.01.2018 bis zum 31.12.2018";"19.11.2019";"70%";"ab583ff6c10622297060f807c76c00aa";"fa10f3c570c7480e";"81879";"Wed Jul  8 23:02:58 2020"
"ADAC Autovermietung GmbH, München; ADAC Camping GmbH, München; ADAC Finanzdienste GmbH, München; ADAC HEMS Academy GmbH, Sankt Augustin; ADAC HEMS und Fachkräfte GmbH, München; ADAC IT Service GmbH, München; ADAC Medien und Reise GmbH, München; ADAC RSR GmbH, München; ADAC Service GmbH, München; ADAC TruckService GmbH & Co. KG, Laichingen; ADAC Versicherung AG, München; Aero-Dienst GmbH & Co. KG, Nürnberg; BPCS Consulting Services GmbH, Unterhaching; Dienstleistungs-Center Halle GmbH (DLC Halle), Halle (Saale); GKS Gesellschaft für Kommunikationsservice mbH, Passau";"Wed Jul  8 23:02:58 2020";"";"";"";"";"";"";""
