"Name";"Bereich";"Information";"V.-Datum";"Relevanz";"session.sessionid=";"fts_search_list.selected";"fts_search_list.destHistoryId";"timestamp"
"anthares GmbH Neunkirchen-Seelscheid (vormals: Köln)";"Rechnungslegung/ Finanzberichte";"» Jahresabschluss zum Geschäftsjahr vom 01.01.2013 bis zum 31.12.2013";"16.02.2015";"92%";"aba51bcc9fdd59516710d900a8a5ca24";"128792b532674836";"20754";"Thu Jul 16 00:59:28 2020"
"anthares GmbH Neunkirchen-Seelscheid (vormals: Köln)";"Rechnungslegung/ Finanzberichte";"» Jahresabschluss zum Geschäftsjahr vom 01.12.2012 bis zum 31.12.2012";"20.02.2014";"92%";"aba51bcc9fdd59516710d900a8a5ca24";"4cfc3574fa0c9a08";"20754";"Thu Jul 16 00:59:28 2020"
"anthares GmbH Köln";"Rechnungslegung/ Finanzberichte";"» Jahresabschluss zum Geschäftsjahr vom 01.01.2011 bis zum 31.12.2011";"28.01.2013";"92%";"aba51bcc9fdd59516710d900a8a5ca24";"0fe019324cda2b34";"20754";"Thu Jul 16 00:59:28 2020"
"anthares GmbH Köln";"Rechnungslegung/ Finanzberichte";"» Jahresabschluss zum Geschäftsjahr vom 01.01.2010 bis zum 31.12.2010";"25.01.2012";"92%";"aba51bcc9fdd59516710d900a8a5ca24";"8f2e14b6af345984";"20754";"Thu Jul 16 00:59:28 2020"
"anthares GmbH Köln (vormals: Neunkirchen-Seelscheid)";"Rechnungslegung/ Finanzberichte";"» Jahresabschluss zum Geschäftsjahr vom 19.05.2009 bis zum 31.12.2009";"17.01.2011";"92%";"aba51bcc9fdd59516710d900a8a5ca24";"4c8af76027467f94";"20754";"Thu Jul 16 00:59:28 2020"
