"Name";"Bereich";"Information";"V.-Datum";"Relevanz";"session.sessionid=";"fts_search_list.selected";"fts_search_list.destHistoryId";"timestamp"
"Aurelius Digital Ventures UG (haftungsbeschränkt) Hardthausen am Kocher";"Rechnungslegung/ Finanzberichte";"» Jahresabschluss zum Geschäftsjahr vom 01.01.2019 bis zum 31.12.2019";"24.06.2020";"100%";"9f0e12c7f320e17bd3028846fa49a6eb";"3fa7235cf4dd6f84";"47353";"Tue Jul 14 10:51:27 2020"
"AURELIUS Real Estate Investments GmbH Grünwald";"Rechnungslegung/ Finanzberichte";"» Jahresabschluss zum Geschäftsjahr vom 01.01.2019 bis zum 31.12.2019";"17.06.2020";"100%";"9f0e12c7f320e17bd3028846fa49a6eb";"b3463af219a57f1d";"47353";"Tue Jul 14 10:51:27 2020"
"AURELIUS Equity Opportunities SE & Co. KGaA Grünwald";"Rechnungslegung/ Finanzberichte";"» Konzernabschluss zum Geschäftsjahr vom 01.01.2019 bis zum 31.12.2019";"09.06.2020";"100%";"9f0e12c7f320e17bd3028846fa49a6eb";"74f88b326e58da56";"47353";"Tue Jul 14 10:51:27 2020"
"Hanse (Deutschland) Vertriebs GmbH & Co.KG, Greifswald";"Tue Jul 14 10:51:27 2020";"";"";"";"";"";"";""
"AURELIUS Equity Opportunities SE & Co. KGaA Grünwald";"Rechnungslegung/ Finanzberichte";"» Jahresabschluss zum Geschäftsjahr vom 01.01.2019 bis zum 31.12.2019";"14.05.2020";"100%";"9f0e12c7f320e17bd3028846fa49a6eb";"e34357431c21c68e";"47353";"Tue Jul 14 10:51:27 2020"
"Roundliner Holding GmbH (vormals: AURELIUS WK Six GmbH) Grünwald";"Rechnungslegung/ Finanzberichte";"» Jahresabschluss zum Geschäftsjahr vom 01.01.2018 bis zum 31.12.2018 Berichtigung der Veröffentlichung vom 02.12.2019";"24.04.2020";"100%";"9f0e12c7f320e17bd3028846fa49a6eb";"8e49b9eba8a89df4";"47353";"Tue Jul 14 10:51:27 2020"
"AURELIUS APARTMENTS UG (haftungsbeschränkt) Lahr";"Rechnungslegung/ Finanzberichte";"» Jahresabschluss zum Geschäftsjahr vom 01.01.2018 bis zum 31.12.2018";"20.04.2020";"100%";"9f0e12c7f320e17bd3028846fa49a6eb";"bc1e8b65b76aa129";"47353";"Tue Jul 14 10:51:27 2020"
"AURELIUS Wachstumskapital SE & Co. KG Grünwald,  Landkreis München";"Rechnungslegung/ Finanzberichte";"» Jahresabschluss zum Geschäftsjahr vom 01.01.2018 bis zum 31.12.2018";"25.03.2020";"100%";"9f0e12c7f320e17bd3028846fa49a6eb";"843b51fd900f76eb";"47353";"Tue Jul 14 10:51:27 2020"
"Aurelius Verwaltungsgesellschaft mbH Hamburg";"Rechnungslegung/ Finanzberichte";"» Jahresabschluss zum Geschäftsjahr vom 01.01.2018 bis zum 31.12.2018";"25.03.2020";"100%";"9f0e12c7f320e17bd3028846fa49a6eb";"67c5bf4e2730337b";"47353";"Tue Jul 14 10:51:27 2020"
"Aurelius Digital Ventures UG (haftungsbeschränkt) Hardthausen am Kocher";"Rechnungslegung/ Finanzberichte";"» Jahresabschluss zum Geschäftsjahr vom 01.01.2018 bis zum 31.12.2018";"04.03.2020";"100%";"9f0e12c7f320e17bd3028846fa49a6eb";"82f91eb0af21f94e";"47353";"Tue Jul 14 10:51:27 2020"
"Airplane-Equipment & Services A.E.S. GmbH (Köln) Grünwald";"Rechnungslegung/ Finanzberichte";"» §§ 264 Abs. 3, 264b HGB zum Geschäftsjahr vom 01.01.2018 bis zum 31.12.2018 AURELIUS WK Two GmbH (Grünwald)";"02.03.2020";"100%";"9f0e12c7f320e17bd3028846fa49a6eb";"cdbdb22505c8758c";"47353";"Tue Jul 14 10:51:27 2020"
"AURELIUS WK Two GmbH Grünwald";"» Konzernabschluss zum Geschäftsjahr vom 01.01.2018 bis zum 31.12.2018";"23.12.2019";"9f0e12c7f320e17bd3028846fa49a6eb";"cdbdb22505c8758c";"47353";"Tue Jul 14 10:51:27 2020";"";""
"AURELIUS WK Management SE Grünwald";"Rechnungslegung/ Finanzberichte";"» Jahresabschluss zum Geschäftsjahr vom 01.01.2018 bis zum 31.12.2018";"25.02.2020";"100%";"9f0e12c7f320e17bd3028846fa49a6eb";"0cc9cb0e79995192";"47353";"Tue Jul 14 10:51:27 2020"
"Aurelius MK One GmbH Wandlitz";"Rechnungslegung/ Finanzberichte";"» Jahresabschluss zum Geschäftsjahr vom 01.01.2018 bis zum 31.12.2018";"06.02.2020";"100%";"9f0e12c7f320e17bd3028846fa49a6eb";"59ae033eb82a4f33";"47353";"Tue Jul 14 10:51:27 2020"
"AURELIUS Theta Invest Holding GmbH Grünwald";"Rechnungslegung/ Finanzberichte";"» Jahresabschluss zum Geschäftsjahr vom 01.01.2018 bis zum 31.12.2018";"05.02.2020";"100%";"9f0e12c7f320e17bd3028846fa49a6eb";"6952ade1e5e61a5c";"47353";"Tue Jul 14 10:51:27 2020"
"Haus Aurelius - SZB Aachen Immobilien GmbH & Co. KG Gangelt";"Rechnungslegung/ Finanzberichte";"» Jahresabschluss zum Geschäftsjahr vom 01.01.2018 bis zum 31.12.2018";"04.02.2020";"100%";"9f0e12c7f320e17bd3028846fa49a6eb";"02f847df2b281d6e";"47353";"Tue Jul 14 10:51:27 2020"
"Haus Aurelius SZB Aachen Alten- und Pflegeheim GmbH Gangelt";"Rechnungslegung/ Finanzberichte";"» Jahresabschluss zum Geschäftsjahr vom 01.01.2018 bis zum 31.12.2018";"03.02.2020";"100%";"9f0e12c7f320e17bd3028846fa49a6eb";"3e30668b40336629";"47353";"Tue Jul 14 10:51:27 2020"
"AURELIUS WK Two GmbH Grünwald";"Rechnungslegung/ Finanzberichte";"» Jahresabschluss zum Geschäftsjahr vom 01.01.2018 bis zum 31.12.2018";"31.01.2020";"100%";"9f0e12c7f320e17bd3028846fa49a6eb";"887440ccbfce2f6b";"47353";"Tue Jul 14 10:51:27 2020"
"AURELIUS Epsilon Invest GmbH Grünwald";"Rechnungslegung/ Finanzberichte";"» Jahresabschluss zum Geschäftsjahr vom 01.01.2018 bis zum 31.12.2018";"27.01.2020";"100%";"9f0e12c7f320e17bd3028846fa49a6eb";"78bf43f73e17bd5e";"47353";"Tue Jul 14 10:51:27 2020"
"AURELIUS Portfolio Management AG München";"Rechnungslegung/ Finanzberichte";"» Jahresabschluss zum Geschäftsjahr vom 01.01.2018 bis zum 31.12.2018";"24.01.2020";"100%";"9f0e12c7f320e17bd3028846fa49a6eb";"fdff71a48315f13f";"47353";"Tue Jul 14 10:51:27 2020"
"AURELIUS Zeta Invest Two GmbH Grünwald";"Rechnungslegung/ Finanzberichte";"» Jahresabschluss zum Geschäftsjahr vom 01.01.2018 bis zum 31.12.2018";"21.01.2020";"100%";"9f0e12c7f320e17bd3028846fa49a6eb";"6f4495bb52251929";"47353";"Tue Jul 14 10:51:27 2020"
"AURELIUS Development Seven GmbH Grünwald";"Rechnungslegung/ Finanzberichte";"» Jahresabschluss zum Geschäftsjahr vom 23.08.2018 bis zum 31.12.2018";"16.01.2020";"100%";"9f0e12c7f320e17bd3028846fa49a6eb";"868a40aca26edc8f";"47353";"Tue Jul 14 10:51:27 2020"
