"Name";"Bereich";"Information";"V.-Datum";"Relevanz";"session.sessionid=";"fts_search_list.selected";"fts_search_list.destHistoryId";"timestamp"
"Detect Value AG Walldorf";"Rechnungslegung/ Finanzberichte";"» Jahresabschluss zum Geschäftsjahr vom 01.01.2018 bis zum 31.12.2018";"29.01.2020";"100%";"9f0e12c7f320e17bd3028846fa49a6eb";"0faafdcc3e2c3cf2";"89598";"Tue Jul 14 03:37:14 2020"
"Series C Euro-DM Securities Limited Saint Helier";"Rechnungslegung/ Finanzberichte";"» Halbjahresfinanzbericht zum 30. Juni 2012";"10.09.2012";"5%";"9f0e12c7f320e17bd3028846fa49a6eb";"68cd5072d0087868";"89598";"Tue Jul 14 03:37:14 2020"
"Euro-DM Securities Limited Saint Helier";"Rechnungslegung/ Finanzberichte";"» Halbjahresfinanzbericht zum 30. Juni 2012";"10.09.2012";"5%";"9f0e12c7f320e17bd3028846fa49a6eb";"db9cafeed10ea5e4";"89598";"Tue Jul 14 03:37:14 2020"
"Series D Euro-DM Securities Limited St Helier";"Rechnungslegung/ Finanzberichte";"» Halbjahresfinanzbericht zum 30.6.2012";"10.09.2012";"5%";"9f0e12c7f320e17bd3028846fa49a6eb";"6ccf06227d97e709";"89598";"Tue Jul 14 03:37:14 2020"
"Series B Euro-DM Securities Limited Saint Helier";"Rechnungslegung/ Finanzberichte";"» Halbjahresfinanzbericht zum 30. Juni 2012";"10.09.2012";"5%";"9f0e12c7f320e17bd3028846fa49a6eb";"286f8a128b5800d4";"89598";"Tue Jul 14 03:37:14 2020"
