"Name";"Bereich";"Information";"V.-Datum";"Relevanz";"session.sessionid=";"fts_search_list.selected";"fts_search_list.destHistoryId";"timestamp"
"EST Elektro-Systemtechnik GmbH Meschede";"Rechnungslegung/ Finanzberichte";"» Jahresabschluss zum Geschäftsjahr vom 01.01.2019 bis zum 31.12.2019";"14.07.2020";"100%";"af75d5dc888ac79ae50ee77806ec50af";"ff0af52f4a238207";"20925";"Wed Jul 15 15:47:11 2020"
"Estée Lauder Companies GmbH München";"Rechnungslegung/ Finanzberichte";"» Jahresabschluss zum Geschäftsjahr vom 01.07.2018 bis zum 30.06.2019";"10.07.2020";"100%";"af75d5dc888ac79ae50ee77806ec50af";"35a04e0571acdbfd";"20925";"Wed Jul 15 15:47:11 2020"
"Estée Lauder Companies GmbH München";"Rechnungslegung/ Finanzberichte";"» Konzernabschluss zum Geschäftsjahr vom 01.07.2018 bis zum 30.06.2019";"08.07.2020";"100%";"af75d5dc888ac79ae50ee77806ec50af";"8829b75345fc30ed";"20925";"Wed Jul 15 15:47:11 2020"
"Dr. Esters & Prof. Dr. Joos & Seifert GmbH & Co. KG Wirtschaftsprüfungsgesellschaft Leutkirch im Allgäu";"Rechnungslegung/ Finanzberichte";"» Jahresabschluss zum Geschäftsjahr vom 01.01.2019 bis zum 31.12.2019";"06.07.2020";"100%";"af75d5dc888ac79ae50ee77806ec50af";"3c9e791ffb362292";"20925";"Wed Jul 15 15:47:11 2020"
"Spoo & Esters GmbH & Co.KG Krefeld";"Rechnungslegung/ Finanzberichte";"» Jahresabschluss zum Geschäftsjahr vom 01.01.2019 bis zum 31.12.2019";"20.05.2020";"100%";"af75d5dc888ac79ae50ee77806ec50af";"e7e8b72be3405fa9";"20925";"Wed Jul 15 15:47:11 2020"
"Esters-Elektronik GmbH Aschaffenburg";"Rechnungslegung/ Finanzberichte";"» Jahresabschluss zum Geschäftsjahr vom 01.01.2018 bis zum 31.12.2018";"19.05.2020";"100%";"af75d5dc888ac79ae50ee77806ec50af";"4424193e0fa8ffb6";"20925";"Wed Jul 15 15:47:11 2020"
"Kita Este GmbH Hamburg";"Rechnungslegung/ Finanzberichte";"» Jahresabschluss zum Geschäftsjahr vom 01.01.2018 bis zum 31.12.2018";"04.05.2020";"100%";"af75d5dc888ac79ae50ee77806ec50af";"0b6cd82919da5dcd";"20925";"Wed Jul 15 15:47:11 2020"
"EST Engineering Systems Technologies GmbH & Co. KG Kaiserslautern";"Rechnungslegung/ Finanzberichte";"» Jahresabschluss zum Geschäftsjahr vom 01.01.2018 bis zum 31.12.2018 Berichtigung der Veröffentlichung vom 27.12.2019";"21.04.2020";"100%";"af75d5dc888ac79ae50ee77806ec50af";"d6c555fe6fe5ba4c";"20925";"Wed Jul 15 15:47:11 2020"
"EST Beteiligungs GmbH Laichingen";"Rechnungslegung/ Finanzberichte";"» Jahresabschluss zum Geschäftsjahr vom 01.01.2018 bis zum 31.12.2018";"20.03.2020";"100%";"af75d5dc888ac79ae50ee77806ec50af";"5db416c3d6e614c3";"20925";"Wed Jul 15 15:47:11 2020"
"Wachdienst Krefeld Wilhelm Esters GmbH Krefeld";"Rechnungslegung/ Finanzberichte";"» Jahresabschluss zum Geschäftsjahr vom 01.01.2018 bis zum 31.12.2018";"20.03.2020";"100%";"af75d5dc888ac79ae50ee77806ec50af";"8ae9137c01dc2d67";"20925";"Wed Jul 15 15:47:11 2020"
"EST Elektro-Steuerungstechnik GmbH Wallenhorst";"Rechnungslegung/ Finanzberichte";"» Jahresabschluss zum Geschäftsjahr vom 01.01.2018 bis zum 31.12.2018";"10.03.2020";"100%";"af75d5dc888ac79ae50ee77806ec50af";"38103e956a7a2220";"20925";"Wed Jul 15 15:47:11 2020"
"Esterer WD GmbH Altötting";"Rechnungslegung/ Finanzberichte";"» Jahresabschluss zum Geschäftsjahr vom 01.01.2018 bis zum 31.12.2018";"27.02.2020";"100%";"af75d5dc888ac79ae50ee77806ec50af";"981a90e0d6abceef";"20925";"Wed Jul 15 15:47:11 2020"
"E S T Elektro Service Team GmbH Magstadt";"Rechnungslegung/ Finanzberichte";"» Jahresabschluss zum Geschäftsjahr vom 01.01.2018 bis zum 31.12.2018";"26.02.2020";"100%";"af75d5dc888ac79ae50ee77806ec50af";"97e7d49b266ba3bd";"20925";"Wed Jul 15 15:47:11 2020"
"EST Eisenbahn-Systemtechnik GmbH Wangen im Allgäu";"Rechnungslegung/ Finanzberichte";"» Jahresabschluss zum Geschäftsjahr vom 01.01.2018 bis zum 31.12.2018";"13.02.2020";"100%";"af75d5dc888ac79ae50ee77806ec50af";"aff5a23767a46c03";"20925";"Wed Jul 15 15:47:11 2020"
"Dr. Esters & Prof. Dr. Joos & Seifert GmbH & Co. KG Wirtschaftsprüfungsgesellschaft Leutkirch im Allgäu";"Rechnungslegung/ Finanzberichte";"» Jahresabschluss zum Geschäftsjahr vom 01.01.2018 bis zum 31.12.2018";"07.02.2020";"100%";"af75d5dc888ac79ae50ee77806ec50af";"0fc5d3533fdde241";"20925";"Wed Jul 15 15:47:11 2020"
"EST Elektro- und Steuerungstechnik GmbH Wuppertal";"Rechnungslegung/ Finanzberichte";"» Jahresabschluss zum Geschäftsjahr vom 01.01.2018 bis zum 31.12.2018";"03.02.2020";"100%";"af75d5dc888ac79ae50ee77806ec50af";"05d3090921b133a8";"20925";"Wed Jul 15 15:47:11 2020"
"EST Energetics GmbH Rothenburg/O.L.";"Rechnungslegung/ Finanzberichte";"» Jahresabschluss zum Geschäftsjahr vom 01.01.2018 bis zum 31.12.2018";"30.01.2020";"100%";"af75d5dc888ac79ae50ee77806ec50af";"00ea539df7d816f2";"20925";"Wed Jul 15 15:47:11 2020"
"Este Kabelverlegung GmbH Neu Wulmstorf";"Rechnungslegung/ Finanzberichte";"» Jahresabschluss zum Geschäftsjahr vom 03.01.2018 bis zum 31.12.2018";"28.01.2020";"100%";"af75d5dc888ac79ae50ee77806ec50af";"af826a0723d62477";"20925";"Wed Jul 15 15:47:11 2020"
"EST Integrata GmbH Aalen";"Rechnungslegung/ Finanzberichte";"» Jahresabschluss zum Geschäftsjahr vom 01.01.2018 bis zum 31.12.2018";"28.01.2020";"100%";"af75d5dc888ac79ae50ee77806ec50af";"07be9f11fe3397c7";"20925";"Wed Jul 15 15:47:11 2020"
"Esters GmbH Magstadt";"Rechnungslegung/ Finanzberichte";"» Jahresabschluss zum Geschäftsjahr vom 01.01.2018 bis zum 31.12.2018";"23.01.2020";"100%";"af75d5dc888ac79ae50ee77806ec50af";"329a5be345e4c99d";"20925";"Wed Jul 15 15:47:11 2020"
