"Name";"Bereich";"Information";"V.-Datum";"Relevanz";"session.sessionid=";"fts_search_list.selected";"fts_search_list.destHistoryId";"timestamp"
"Fashion Digital GmbH & Co. KG (vormals:  Mode IT Systems GmbH & Co. KG) Düsseldorf";"Rechnungslegung/ Finanzberichte";"» Jahresabschluss zum Geschäftsjahr vom 01.01.2018 bis zum 31.12.2018";"26.02.2020";"100%";"c1affca00be00815e8f7ff00abde0b30";"d3106504ce09fc14";"09354";"Wed Jul 15 06:45:44 2020"
"Fashion Digital GmbH & Co. KG (vormals: Mode IT Systems GmbH & Co. KG) Düsseldorf";"Rechnungslegung/ Finanzberichte";"» Jahresabschluss zum Geschäftsjahr vom 01.01.2017 bis zum 31.12.2017";"07.03.2019";"100%";"c1affca00be00815e8f7ff00abde0b30";"b1171eaab33b9dd0";"09354";"Wed Jul 15 06:45:44 2020"
"iShares (DE) I Investmentaktiengesellschaft mit Teilgesellschaftsvermögen München";"Rechnungslegung/ Finanzberichte";"» Halbjahresfinanzbericht zum 31.08.2019";"16.12.2019";"10%";"c1affca00be00815e8f7ff00abde0b30";"34acfd0304fdd957";"09354";"Wed Jul 15 06:45:44 2020"
"Rocket Internet SE Berlin";"Rechnungslegung/ Finanzberichte";"» Halbjahresfinanzbericht zum 30. Juni 2016";"07.12.2016";"5%";"c1affca00be00815e8f7ff00abde0b30";"a21d9d856b8013c5";"09354";"Wed Jul 15 06:45:44 2020"
"Sedo Holding AG Köln";"Rechnungslegung/ Finanzberichte";"» Halbjahresfinanzbericht zum 30. Juni 2011";"14.09.2011";"5%";"c1affca00be00815e8f7ff00abde0b30";"0e239ad8a8607ef4";"09354";"Wed Jul 15 06:45:44 2020"
