"Name";"Bereich";"Information";"V.-Datum";"Relevanz";"session.sessionid=";"fts_search_list.selected";"fts_search_list.destHistoryId";"timestamp"
"FBS Office Systeme GmbH Schorndorf";"Rechnungslegung/ Finanzberichte";"» Jahresabschluss zum Geschäftsjahr vom 01.01.2019 bis zum 31.12.2019";"02.07.2020";"100%";"aba51bcc9fdd59516710d900a8a5ca24";"ddfdda53afd7b9bf";"12791";"Thu Jul 16 00:04:17 2020"
"ADVISA FBS Dortmund GmbH Steuerberatungsgesellschaft Dortmund";"Rechnungslegung/ Finanzberichte";"» Jahresabschluss zum Geschäftsjahr vom 01.01.2019 bis zum 31.12.2019";"23.04.2020";"100%";"aba51bcc9fdd59516710d900a8a5ca24";"ba9ac22b15587d8e";"12791";"Thu Jul 16 00:04:17 2020"
"FBS Bürosysteme Gesellschaft mit beschränkter Haftung Leinfelden-Echterdingen";"Rechnungslegung/ Finanzberichte";"» Jahresabschluss zum Geschäftsjahr vom 01.01.2019 bis zum 31.12.2019";"06.04.2020";"100%";"aba51bcc9fdd59516710d900a8a5ca24";"c19056c1d4a21c47";"12791";"Thu Jul 16 00:04:17 2020"
"FBS GmbH Saarlouis";"Rechnungslegung/ Finanzberichte";"» Jahresabschluss zum Geschäftsjahr vom 01.01.2018 bis zum 31.12.2018";"19.03.2020";"100%";"aba51bcc9fdd59516710d900a8a5ca24";"04f64807a194c650";"12791";"Thu Jul 16 00:04:17 2020"
"A+G FBS 106 GmbH & Co. KG Rülzheim (vormals: Bellheim)";"Rechnungslegung/ Finanzberichte";"» Jahresabschluss zum Geschäftsjahr vom 01.01.2018 bis zum 31.12.2018";"17.03.2020";"100%";"aba51bcc9fdd59516710d900a8a5ca24";"6be30d8d832da05e";"12791";"Thu Jul 16 00:04:17 2020"
"FBS-Fertigbeton Verwaltungsgesellschaft mit beschränkter Haftung,  Sachsen und Sachsen-Anhalt Großpösna";"Rechnungslegung/ Finanzberichte";"» Jahresabschluss zum Geschäftsjahr vom 01.01.2018 bis zum 31.12.2018";"12.03.2020";"100%";"aba51bcc9fdd59516710d900a8a5ca24";"683cd21610026d30";"12791";"Thu Jul 16 00:04:17 2020"
"FBS Projekte Rackwitz GmbH Rackwitz";"Rechnungslegung/ Finanzberichte";"» Jahresabschluss zum Geschäftsjahr vom 01.01.2018 bis zum 31.12.2018";"12.03.2020";"100%";"aba51bcc9fdd59516710d900a8a5ca24";"e31608fded7760db";"12791";"Thu Jul 16 00:04:17 2020"
"FBS Fahrzeugbeschaffungsservice GmbH Henstedt-Ulzburg";"Rechnungslegung/ Finanzberichte";"» Jahresabschluss zum Geschäftsjahr vom 01.01.2018 bis zum 31.12.2018";"12.03.2020";"100%";"aba51bcc9fdd59516710d900a8a5ca24";"88876ba89717ab8a";"12791";"Thu Jul 16 00:04:17 2020"
"FBS Marketing und Raumausstattung Steckhan GmbH Adenbüttel";"Rechnungslegung/ Finanzberichte";"» Jahresabschluss zum Geschäftsjahr vom 01.01.2018 bis zum 31.12.2018";"19.02.2020";"100%";"aba51bcc9fdd59516710d900a8a5ca24";"e088d2c2cd40d220";"12791";"Thu Jul 16 00:04:17 2020"
"FBS-Bedachungen GmbH Hemmingen";"Rechnungslegung/ Finanzberichte";"» Jahresabschluss zum Geschäftsjahr vom 01.01.2018 bis zum 31.12.2018";"04.02.2020";"100%";"aba51bcc9fdd59516710d900a8a5ca24";"d32b3b5d06dc02c3";"12791";"Thu Jul 16 00:04:17 2020"
"FBS Office Systeme GmbH Schorndorf";"Rechnungslegung/ Finanzberichte";"» Jahresabschluss zum Geschäftsjahr vom 01.01.2018 bis zum 31.12.2018";"21.01.2020";"100%";"aba51bcc9fdd59516710d900a8a5ca24";"8e706408dd9ae8bd";"12791";"Thu Jul 16 00:04:17 2020"
"FBS,  Franconia Business Services GmbH Nürnberg";"Rechnungslegung/ Finanzberichte";"» Jahresabschluss zum Geschäftsjahr vom 01.01.2018 bis zum 31.12.2018";"21.01.2020";"100%";"aba51bcc9fdd59516710d900a8a5ca24";"e297a50e5dc9f2cd";"12791";"Thu Jul 16 00:04:17 2020"
"FBS Fahrzeugnachrüstung GmbH Kelkheim (Taunus)";"Rechnungslegung/ Finanzberichte";"» Jahresabschluss zum Geschäftsjahr vom 01.01.2018 bis zum 31.12.2018";"20.01.2020";"100%";"aba51bcc9fdd59516710d900a8a5ca24";"91542b9a8be59f99";"12791";"Thu Jul 16 00:04:17 2020"
"FBS Freiflächenbau und Bauservice GmbH Rackwitz";"Rechnungslegung/ Finanzberichte";"» Jahresabschluss zum Geschäftsjahr vom 01.01.2018 bis zum 31.12.2018";"18.12.2019";"100%";"aba51bcc9fdd59516710d900a8a5ca24";"25ececd0a5cc3e58";"12791";"Thu Jul 16 00:04:17 2020"
"FBS Industriedemontagen GmbH Leipzig";"Rechnungslegung/ Finanzberichte";"» Jahresabschluss zum Geschäftsjahr vom 01.01.2018 bis zum 31.12.2018";"18.12.2019";"100%";"aba51bcc9fdd59516710d900a8a5ca24";"49b23d6dec1ccd00";"12791";"Thu Jul 16 00:04:17 2020"
"FBS Fessel Bau Service GmbH Garbsen";"Rechnungslegung/ Finanzberichte";"» Jahresabschluss zum Geschäftsjahr vom 01.01.2018 bis zum 31.12.2018";"16.12.2019";"100%";"aba51bcc9fdd59516710d900a8a5ca24";"be432408fc9986fe";"12791";"Thu Jul 16 00:04:17 2020"
"FBS Fuhrpark Business Service GmbH Berlin";"Rechnungslegung/ Finanzberichte";"» Jahresabschluss zum Geschäftsjahr vom 01.01.2018 bis zum 31.12.2018";"05.12.2019";"100%";"aba51bcc9fdd59516710d900a8a5ca24";"57592416f0b42923";"12791";"Thu Jul 16 00:04:17 2020"
"hilzinger FBS GmbH Zülpich";"Rechnungslegung/ Finanzberichte";"» §§ 264 Abs. 3, 264b HGB zum Geschäftsjahr vom 01.01.2018 bis zum 31.12.2018 hilzinger Holding GmbH (Willstätt)";"21.11.2019";"100%";"aba51bcc9fdd59516710d900a8a5ca24";"acb7af93f0a1cab7";"12791";"Thu Jul 16 00:04:17 2020"
"hilzinger Holding GmbH Willstätt";"» Konzernabschluss zum Geschäftsjahr vom 01.01.2018 bis zum 31.12.2018";"27.12.2019";"aba51bcc9fdd59516710d900a8a5ca24";"acb7af93f0a1cab7";"12791";"Thu Jul 16 00:04:17 2020";"";""
"FBS Industry GmbH & Co. KG Solingen";"Rechnungslegung/ Finanzberichte";"» Jahresabschluss zum Geschäftsjahr vom 01.01.2018 bis zum 31.12.2018";"05.11.2019";"100%";"aba51bcc9fdd59516710d900a8a5ca24";"60316c74d7734a45";"12791";"Thu Jul 16 00:04:17 2020"
"FBS  Maschinenbau und -bearbeitung GmbH. Velbert";"Rechnungslegung/ Finanzberichte";"» Jahresabschluss zum Geschäftsjahr vom 01.01.2018 bis zum 31.12.2018";"27.09.2019";"100%";"aba51bcc9fdd59516710d900a8a5ca24";"2ca3cc1a102ecd42";"12791";"Thu Jul 16 00:04:17 2020"
