"Name";"Bereich";"Information";"V.-Datum";"Relevanz";"session.sessionid=";"fts_search_list.selected";"fts_search_list.destHistoryId";"timestamp"
"Frankfurter Buchmesse GmbH Frankfurt am Main";"Rechnungslegung/ Finanzberichte";"» Jahresabschluss zum Geschäftsjahr vom 01.01.2018 bis zum 31.12.2018";"22.10.2019";"100%";"0e6ad8a5ee8151adc1fb7843153d0870";"c82f8b36aab5c226";"06999";"Thu Jul 16 02:00:17 2020"
"Frankfurter Buchmesse GmbH Frankfurt am Main";"Rechnungslegung/ Finanzberichte";"» Jahresabschluss zum Geschäftsjahr vom 01.01.2017 bis zum 31.12.2017";"31.10.2018";"100%";"0e6ad8a5ee8151adc1fb7843153d0870";"2a83e80a48a67c28";"06999";"Thu Jul 16 02:00:17 2020"
"Frankfurter Buchmesse GmbH (vormals: BAGL GmbH) Frankfurt am Main";"Rechnungslegung/ Finanzberichte";"» Jahresabschluss zum Geschäftsjahr vom 01.01.2016 bis zum 31.12.2016";"28.02.2018";"95%";"0e6ad8a5ee8151adc1fb7843153d0870";"19272d1649541020";"06999";"Thu Jul 16 02:00:17 2020"
"Frankfurter Buchmesse GmbH (vormals: Ausstellungs -und Messe - GmbH des Börsenvereins
                                       des Deutschen Buchhandels) Frankfurt am Main";"Rechnungslegung/ Finanzberichte";"» Jahresabschluss zum Geschäftsjahr vom 01.01.2015 bis zum 31.12.2015";"04.01.2017";"95%";"0e6ad8a5ee8151adc1fb7843153d0870";"2f4067c91cb7bcc0";"06999";"Thu Jul 16 02:00:17 2020"
"Frankfurter Buchmesse GmbH (vormals: BAGL GmbH) Frankfurt am Main";"Rechnungslegung/ Finanzberichte";"» Jahresabschluss zum Geschäftsjahr vom 01.01.2015 bis zum 31.12.2015";"06.12.2016";"95%";"0e6ad8a5ee8151adc1fb7843153d0870";"cc38f7f0b0546f60";"06999";"Thu Jul 16 02:00:17 2020"
"Kreissparkasse Groß-Gerau Groß-Gerau";"Rechnungslegung/ Finanzberichte";"» Gesonderter nichtfinanzieller Bericht außerhalb des Lageberichts";"25.04.2019";"10%";"0e6ad8a5ee8151adc1fb7843153d0870";"4875f76e4a98a4df";"06999";"Thu Jul 16 02:00:17 2020"
"Jack White Productions AG Berlin";"Rechnungslegung/ Finanzberichte";"» Halbjahresabschlussfür den Zeitraum vom 01. Januar 2007 bis 30. Juni 2007";"01.10.2007";"5%";"0e6ad8a5ee8151adc1fb7843153d0870";"89ad1c4426c0c4e2";"06999";"Thu Jul 16 02:00:17 2020"
