"Name";"Bereich";"Information";"V.-Datum";"Relevanz";"session.sessionid=";"fts_search_list.selected";"fts_search_list.destHistoryId";"timestamp"
"Inkasso Südbaden GmbH (vormals: Spiegel Gesellschaft für Forderungsmanagement mbH) Kaiserslautern (vormals: Mannheim)";"Rechnungslegung/ Finanzberichte";"» Jahresabschluss zum Geschäftsjahr vom 01.01.2018 bis zum 31.12.2018";"20.01.2020";"100%";"7d4f5151cef23c22a39a7b01f44e8e87";"cd64f00962b94957";"05343";"Wed Jul 15 08:08:41 2020"
"Inkasso Südbaden GmbH Herbolzheim";"Rechnungslegung/ Finanzberichte";"» Jahresabschluss zum Geschäftsjahr vom 01.01.2014 bis zum 31.12.2014";"01.02.2016";"95%";"7d4f5151cef23c22a39a7b01f44e8e87";"4b4bb4cf5853fc22";"05343";"Wed Jul 15 08:08:41 2020"
"Inkasso Südbaden GmbH Herbolzheim";"Rechnungslegung/ Finanzberichte";"» Jahresabschluss zum Geschäftsjahr vom 01.01.2013 bis zum 31.12.2013";"05.01.2015";"95%";"7d4f5151cef23c22a39a7b01f44e8e87";"03b44a2f90f3b197";"05343";"Wed Jul 15 08:08:41 2020"
"Inkasso Südbaden GmbH Herbolzheim";"Rechnungslegung/ Finanzberichte";"» Jahresabschluss zum Geschäftsjahr vom 01.01.2012 bis zum 31.12.2012";"28.10.2013";"95%";"7d4f5151cef23c22a39a7b01f44e8e87";"74791cc0f6a85a67";"05343";"Wed Jul 15 08:08:41 2020"
"Inkasso Südbaden GmbH (vormals: Inkasso Südbaden UG (haftungsbeschränkt)) Herbolzheim";"Rechnungslegung/ Finanzberichte";"» Jahresabschluss zum Geschäftsjahr vom 09.12.2011 bis zum 31.12.2011";"18.03.2013";"95%";"7d4f5151cef23c22a39a7b01f44e8e87";"28881a63f5cf4415";"05343";"Wed Jul 15 08:08:41 2020"
