"Name";"Bereich";"Information";"V.-Datum";"Relevanz";"session.sessionid=";"fts_search_list.selected";"fts_search_list.destHistoryId";"timestamp"
"MVS Immobilien Consulting GmbH & Co. KG Frankfurt am Main";"Rechnungslegung/ Finanzberichte";"» Jahresabschluss zum Geschäftsjahr vom 01.01.2018 bis zum 31.12.2018";"15.06.2020";"100%";"c1affca00be00815e8f7ff00abde0b30";"f4a1a0119f7cedfb";"11435";"Wed Jul 15 02:11:20 2020"
"MVS Medizinischer Vermittlungsservice GmbH Offenbach am Main";"Rechnungslegung/ Finanzberichte";"» Jahresabschluss zum Geschäftsjahr vom 01.01.2018 bis zum 31.12.2018";"27.03.2020";"100%";"c1affca00be00815e8f7ff00abde0b30";"fefca8afeb11d7ee";"11435";"Wed Jul 15 02:11:20 2020"
"MvS Metallverarbeitung Schlodt GmbH Soltau";"Rechnungslegung/ Finanzberichte";"» Jahresabschluss zum Geschäftsjahr vom 01.01.2018 bis zum 31.12.2018";"26.03.2020";"100%";"c1affca00be00815e8f7ff00abde0b30";"9b7472e8a4e46203";"11435";"Wed Jul 15 02:11:20 2020"
"MVS Montage Service GmbH Bürstadt";"Rechnungslegung/ Finanzberichte";"» Jahresabschluss zum Geschäftsjahr vom 01.01.2018 bis zum 31.12.2018";"23.03.2020";"100%";"c1affca00be00815e8f7ff00abde0b30";"ef4e35c904df6e43";"11435";"Wed Jul 15 02:11:20 2020"
"MVS Medizinisches Versorgungszentrum für Schmerztherapie und Anästhesie GmbH Trier";"Rechnungslegung/ Finanzberichte";"» Jahresabschluss zum Geschäftsjahr vom 01.01.2018 bis zum 31.12.2018";"20.03.2020";"100%";"c1affca00be00815e8f7ff00abde0b30";"58bc51dbaef97cac";"11435";"Wed Jul 15 02:11:20 2020"
"MvsM GmbH & Co. KG Erftstadt";"Rechnungslegung/ Finanzberichte";"» Jahresabschluss zum Geschäftsjahr vom 20.06.2018 bis zum 31.12.2018";"19.03.2020";"100%";"c1affca00be00815e8f7ff00abde0b30";"510de0ab110a9e3d";"11435";"Wed Jul 15 02:11:20 2020"
"MvsM Verwaltungs GmbH Erftstadt";"Rechnungslegung/ Finanzberichte";"» Jahresabschluss zum Geschäftsjahr vom 08.06.2018 bis zum 31.12.2018";"18.03.2020";"100%";"c1affca00be00815e8f7ff00abde0b30";"b5319693a4b08161";"11435";"Wed Jul 15 02:11:20 2020"
"MVS Interiors GmbH Hamburg";"Rechnungslegung/ Finanzberichte";"» Jahresabschluss zum Geschäftsjahr vom 01.01.2018 bis zum 31.12.2018";"05.03.2020";"100%";"c1affca00be00815e8f7ff00abde0b30";"7d7c16681f853d81";"11435";"Wed Jul 15 02:11:20 2020"
"MVS Metallvertriebs- und Service GmbH Schloß Holte-Stukenbrock";"Rechnungslegung/ Finanzberichte";"» Jahresabschluss zum Geschäftsjahr vom 01.01.2018 bis zum 31.12.2018";"19.02.2020";"100%";"c1affca00be00815e8f7ff00abde0b30";"70f02991dec16e78";"11435";"Wed Jul 15 02:11:20 2020"
"MVS Exclusive Constructions GmbH Schweindorf";"Rechnungslegung/ Finanzberichte";"» Jahresabschluss zum Geschäftsjahr vom 01.01.2018 bis zum 31.12.2018";"12.02.2020";"100%";"c1affca00be00815e8f7ff00abde0b30";"5ba14b1902eec12f";"11435";"Wed Jul 15 02:11:20 2020"
"MVS Meininger Verlagsservice GmbH Meiningen";"Rechnungslegung/ Finanzberichte";"» Jahresabschluss zum Geschäftsjahr vom 01.01.2018 bis zum 31.12.2018";"10.02.2020";"100%";"c1affca00be00815e8f7ff00abde0b30";"c609f6511ea49da3";"11435";"Wed Jul 15 02:11:20 2020"
"MVS Medienservice GmbH München (vormals: Roßtal)";"Rechnungslegung/ Finanzberichte";"» Jahresabschluss zum Geschäftsjahr vom 01.01.2018 bis zum 31.12.2018";"23.01.2020";"100%";"c1affca00be00815e8f7ff00abde0b30";"4bc4a5da666c765a";"11435";"Wed Jul 15 02:11:20 2020"
"MVS GmbH Sittensen";"Rechnungslegung/ Finanzberichte";"» Jahresabschluss zum Geschäftsjahr vom 01.01.2018 bis zum 31.12.2018";"20.01.2020";"100%";"c1affca00be00815e8f7ff00abde0b30";"f4689c99bfd805e9";"11435";"Wed Jul 15 02:11:20 2020"
"MvS-Service,  Flug- und Reisevermittlung GmbH München";"Rechnungslegung/ Finanzberichte";"» Jahresabschluss zum Geschäftsjahr vom 01.01.2018 bis zum 31.12.2018";"19.12.2019";"100%";"c1affca00be00815e8f7ff00abde0b30";"487924b924eef37d";"11435";"Wed Jul 15 02:11:20 2020"
"MVS Maschinen,  Vorrichtungen und Service GmbH Manching";"Rechnungslegung/ Finanzberichte";"» Jahresabschluss zum Geschäftsjahr vom 01.01.2018 bis zum 31.12.2018";"17.12.2019";"100%";"c1affca00be00815e8f7ff00abde0b30";"fa05d5d32ee7ff1d";"11435";"Wed Jul 15 02:11:20 2020"
"MVS Mobil Vermiet - Service GmbH Bremen";"Rechnungslegung/ Finanzberichte";"» §§ 264 Abs. 3, 264b HGB zum Geschäftsjahr vom 01.01.2018 bis zum 31.12.2018 Bremer Fahrzeughaus SCHMIDT + KOCH AKTIENGESELLSCHAFT (Bremen)";"03.12.2019";"100%";"c1affca00be00815e8f7ff00abde0b30";"4a976761d655d53f";"11435";"Wed Jul 15 02:11:20 2020"
"Bremer Fahrzeughaus SCHMIDT + KOCH AKTIENGESELLSCHAFT Bremen";"» Konzernabschluss zum Geschäftsjahr vom 01.01.2018 bis zum 31.12.2018";"12.12.2019";"c1affca00be00815e8f7ff00abde0b30";"4a976761d655d53f";"11435";"Wed Jul 15 02:11:20 2020";"";""
"MVS Erotikstar GmbH Herne";"Rechnungslegung/ Finanzberichte";"» Jahresabschluss zum Geschäftsjahr vom 01.10.2017 bis zum 30.09.2018";"22.11.2019";"100%";"c1affca00be00815e8f7ff00abde0b30";"a140cf7599e58d67";"11435";"Wed Jul 15 02:11:20 2020"
"MVS Milchvermarktungs-GmbH Pfaffing Lkr. Rosenheim";"Rechnungslegung/ Finanzberichte";"» Jahresabschluss zum Geschäftsjahr vom 01.01.2018 bis zum 31.12.2018";"17.09.2019";"100%";"c1affca00be00815e8f7ff00abde0b30";"ecc2c97fad69c046";"11435";"Wed Jul 15 02:11:20 2020"
"CB und MvS Beteiligungsgesellschaft mbH Düsseldorf";"Rechnungslegung/ Finanzberichte";"» Jahresabschluss zum Geschäftsjahr vom 01.01.2018 bis zum 31.12.2018";"12.08.2019";"100%";"c1affca00be00815e8f7ff00abde0b30";"bfbda56fe74a4444";"11435";"Wed Jul 15 02:11:20 2020"
"MVS-Dienstleistungs GmbH & Co. KG Steinheim";"Rechnungslegung/ Finanzberichte";"» Jahresabschluss zum Geschäftsjahr vom 01.07.2017 bis zum 30.06.2018";"10.07.2019";"100%";"c1affca00be00815e8f7ff00abde0b30";"4f6909d081a5923a";"11435";"Wed Jul 15 02:11:20 2020"
