"Name";"Bereich";"Information";"V.-Datum";"Relevanz";"session.sessionid=";"fts_search_list.selected";"fts_search_list.destHistoryId";"timestamp"
"Proservia GmbH Eschborn";"Rechnungslegung/ Finanzberichte";"» §§ 264 Abs. 3, 264b HGB zum Geschäftsjahr vom 01.01.2017 bis zum 31.12.2017 ManpowerGroup Deutschland Verwaltungs GmbH (Frankfurt am Main)";"01.04.2019";"100%";"c1affca00be00815e8f7ff00abde0b30";"5a5261e196c19f2a";"71030";"Wed Jul 15 09:48:40 2020"
"ManpowerGroup Deutschland Verwaltungs GmbH (vormals: ManpowerGroup Deutschland GmbH) Frankfurt am Main (vormals: Eschborn)";"» Konzernabschluss zum Geschäftsjahr vom 01.01.2017 bis zum 31.12.2017";"03.04.2019";"c1affca00be00815e8f7ff00abde0b30";"5a5261e196c19f2a";"71030";"Wed Jul 15 09:48:40 2020";"";""
"Proservia GmbH Eschborn";"Rechnungslegung/ Finanzberichte";"» Bekanntmachung nach §§ 264 Abs. 3, 264b HGB zum Geschäftsjahr vom 01.01.2016 bis zum
                                          31.12.2016 ManpowerGroup Deutschland GmbH (Eschborn)";"28.03.2018";"92%";"c1affca00be00815e8f7ff00abde0b30";"a7d6315145f49ae2";"71030";"Wed Jul 15 09:48:40 2020"
"ManpowerGroup Deutschland GmbH Eschborn";"» Konzernabschluss zum Geschäftsjahr vom 01.01.2016 bis zum 31.12.2016";"28.05.2018";"c1affca00be00815e8f7ff00abde0b30";"a7d6315145f49ae2";"71030";"Wed Jul 15 09:48:40 2020";"";""
"Proservia GmbH (vormals: AviationworX Services GmbH) Eschborn";"Rechnungslegung/ Finanzberichte";"» §§ 264 Abs. 3, 264b HGB zum Geschäftsjahr vom 01.01.2015 bis zum 31.12.2015 Manpower GmbH & Co. KG Personaldienstleistungen (Eschborn)";"15.02.2017";"92%";"c1affca00be00815e8f7ff00abde0b30";"30f0c039f6825398";"71030";"Wed Jul 15 09:48:40 2020"
"ManpowerGroup Deutschland Verwaltungs GmbH (vormals: ManpowerGroup Deutschland GmbH) Frankfurt am Main (vormals: Eschborn)";"Rechnungslegung/ Finanzberichte";"» Konzernabschluss zum Geschäftsjahr vom 01.01.2017 bis zum 31.12.2017";"03.04.2019";"83%";"c1affca00be00815e8f7ff00abde0b30";"16a1612ff705d831";"71030";"Wed Jul 15 09:48:40 2020"
"7S Group GmbH, Jena; Arcqus GmbH, Hamburg; Edwork GmbH & Co. KG, Fulda; Experis GmbH, Eschborn; FAO Office GmbH, Frankfurt am Main; K&K HR-Services GmbH, Jena; Manpower Beteiligungsgesellschaft mbH, Frankfurt am Main; ManpowerGroup Deutschland GmbH & Co. KG, Frankfurt am Main; ManpowerGroup Solutions GmbH, Eschborn; Montaplan GmbH, Hürth; OnYourSite GmbH, Mainz; PADES Personalservice GmbH, München; Proservia Field Services GmbH, Eschborn; Proservia GmbH, Eschborn; Shoga GmbH, Stuttgart; Siebenlist, Grey & Partner GmbH, Eschborn; Splu Experts GmbH, Stuttgart; Stegdoc GmbH, Mainz; Stegmann Personaldienstleistung GmbH, Mainz; Stegmed GmbH, Stuttgart; VIS GmbH, Bonn; Wolleschensky Personalmanagement GmbH, Nürnberg";"Wed Jul 15 09:48:40 2020";"";"";"";"";"";"";""
"ManpowerGroup Deutschland GmbH Eschborn";"Rechnungslegung/ Finanzberichte";"» Konzernabschluss zum Geschäftsjahr vom 01.01.2016 bis zum 31.12.2016";"28.05.2018";"75%";"c1affca00be00815e8f7ff00abde0b30";"9cc9fe48436d251f";"71030";"Wed Jul 15 09:48:40 2020"
"7S Group GmbH, Jena; AIM GmbH & Co. KG, Schönefeld; Arcqus GmbH, Hamburg; AviationPower TechnicalServices GmbH, Frankfurt am Main; Edwork GmbH & Co. KG, Fulda; Experis GmbH, Eschborn; FAO Office GmbH, Frankfurt am Main; K&K HR-Services GmbH, Jena; Manpower Beteiligungsgesellschaft mbH, Eschborn; Manpower GmbH & Co. KG Personaldienstleistungen, Eschborn; ManpowerGroup Solutions GmbH, Eschborn; MFP Production GmbH & Co. KG, Berlin; Montaplan GmbH, Hürth; OnYourSite GmbH, Mainz; PADES Personalservice GmbH, München; Proservia GmbH, Eschborn; Servitus Haus- und Küchendienste GmbH, Frankfurt; Shoga GmbH, Stuttgart; Siebenlist, Grey & Partner GmbH, Eschborn; Splu Experts GmbH, Stuttgart; Stegdoc GmbH, Mainz; Stegmann Personaldienstleistung GmbH, Mainz; Stegmed GmbH, Stuttgart; Wolleschensky Personalmanagement GmbH, Nürnberg";"Wed Jul 15 09:48:40 2020";"";"";"";"";"";"";""
