"Name";"Bereich";"Information";"V.-Datum";"Relevanz";"session.sessionid=";"fts_search_list.selected";"fts_search_list.destHistoryId";"timestamp"
"QDA Solutions Verwaltungs GmbH Lübeck";"Rechnungslegung/ Finanzberichte";"» Jahresabschluss zum Geschäftsjahr vom 01.01.2018 bis zum 31.12.2018";"18.02.2020";"100%";"af75d5dc888ac79ae50ee77806ec50af";"d314b7202f7d4e9a";"88699";"Wed Jul 15 14:53:05 2020"
"QDA Solutions GmbH Lübeck";"Rechnungslegung/ Finanzberichte";"» Jahresabschluss zum Geschäftsjahr vom 01.01.2018 bis zum 31.12.2018";"05.02.2020";"100%";"af75d5dc888ac79ae50ee77806ec50af";"a5a4556f0d53d9be";"88699";"Wed Jul 15 14:53:05 2020"
"QDA Solutions Verwaltungs GmbH Lübeck (vormals: München)";"Rechnungslegung/ Finanzberichte";"» Jahresabschluss zum Geschäftsjahr vom 01.01.2017 bis zum 31.12.2017";"15.02.2019";"100%";"af75d5dc888ac79ae50ee77806ec50af";"99561149a10d6294";"88699";"Wed Jul 15 14:53:05 2020"
"QDA Solutions GmbH Lübeck";"Rechnungslegung/ Finanzberichte";"» Jahresabschluss zum Geschäftsjahr vom 01.01.2017 bis zum 31.12.2017";"25.01.2019";"100%";"af75d5dc888ac79ae50ee77806ec50af";"92490bdd4205d9ac";"88699";"Wed Jul 15 14:53:05 2020"
"QDA Solutions Verwaltungs GmbH München";"Rechnungslegung/ Finanzberichte";"» Jahresabschluss zum Geschäftsjahr vom 12.10.2016 bis zum 31.12.2016";"22.01.2018";"95%";"af75d5dc888ac79ae50ee77806ec50af";"1105a221444b8eb9";"88699";"Wed Jul 15 14:53:05 2020"
"QDA Solutions GmbH Lübeck";"Rechnungslegung/ Finanzberichte";"» Jahresabschluss zum Geschäftsjahr vom 01.01.2016 bis zum 31.12.2016";"06.09.2017";"95%";"af75d5dc888ac79ae50ee77806ec50af";"b6f0036b7abdacbe";"88699";"Wed Jul 15 14:53:05 2020"
