"Name";"Bereich";"Information";"V.-Datum";"Relevanz";"session.sessionid=";"fts_search_list.selected";"fts_search_list.destHistoryId";"timestamp"
"Ramboll Holding GmbH Hamburg";"Rechnungslegung/ Finanzberichte";"» Jahresabschluss zum Geschäftsjahr vom 01.01.2017 bis zum 31.12.2017";"21.11.2019";"100%";"9f0e12c7f320e17bd3028846fa49a6eb";"95168ee118568ecd";"00896";"Tue Jul 14 16:40:50 2020"
"Ramboll GmbH (vormals: Ramboll IMS Ingenieurgesellschaft mbH) Hamburg";"Rechnungslegung/ Finanzberichte";"» Jahresabschluss zum Geschäftsjahr vom 01.01.2018 bis zum 31.12.2018";"12.11.2019";"100%";"9f0e12c7f320e17bd3028846fa49a6eb";"60e23d9134eedd5f";"00896";"Tue Jul 14 16:40:50 2020"
"Ramboll CUBE GmbH (vormals: CUBE Engineering GmbH) Kassel";"Rechnungslegung/ Finanzberichte";"» Jahresabschluss zum Geschäftsjahr vom 01.01.2017 bis zum 31.12.2017";"20.09.2019";"100%";"9f0e12c7f320e17bd3028846fa49a6eb";"362e8f5989d28d18";"00896";"Tue Jul 14 16:40:50 2020"
"Ramboll BBB GmbH (vormals: BBB Umwelttechnik erneuerbare Energien GmbH) Gelsenkirchen";"Rechnungslegung/ Finanzberichte";"» Jahresabschluss zum Geschäftsjahr vom 01.01.2017 bis zum 31.12.2017";"30.08.2019";"100%";"9f0e12c7f320e17bd3028846fa49a6eb";"2b94b77183b23c50";"00896";"Tue Jul 14 16:40:50 2020"
"Ramboll Studio Dreiseitl GmbH Überlingen";"Rechnungslegung/ Finanzberichte";"» Jahresabschluss zum Geschäftsjahr vom 01.01.2017 bis zum 31.12.2017";"21.05.2019";"100%";"9f0e12c7f320e17bd3028846fa49a6eb";"6e7a4bf8b7a3fc50";"00896";"Tue Jul 14 16:40:50 2020"
"Ramboll Management Consulting GmbH Hamburg";"Rechnungslegung/ Finanzberichte";"» Jahresabschluss zum Geschäftsjahr vom 01.01.2017 bis zum 31.12.2017";"10.05.2019";"100%";"9f0e12c7f320e17bd3028846fa49a6eb";"8ef5403dbbb65f7c";"00896";"Tue Jul 14 16:40:50 2020"
"Ramboll GmbH (vormals: Ramboll IMS Ingenieurgesellschaft mbH) Hamburg";"Rechnungslegung/ Finanzberichte";"» Jahresabschluss zum Geschäftsjahr vom 01.01.2017 bis zum 31.12.2017";"10.05.2019";"100%";"9f0e12c7f320e17bd3028846fa49a6eb";"969ef2697da69d73";"00896";"Tue Jul 14 16:40:50 2020"
"Ramboll GmbH (vormals: Ramboll IMS Ingenieurgesellschaft mbH) Hamburg";"Rechnungslegung/ Finanzberichte";"» Jahresabschluss zum Geschäftsjahr vom 01.01.2016 bis zum 31.12.2016 Ergänzung der Veröffentlichung vom 16.05.2018";"11.03.2019";"100%";"9f0e12c7f320e17bd3028846fa49a6eb";"94eefd77cca12e94";"00896";"Tue Jul 14 16:40:50 2020"
"Ramboll Environment & Health GmbH (vormals: BIPRO GmbH) München";"Rechnungslegung/ Finanzberichte";"» Jahresabschluss zum Geschäftsjahr vom 01.01.2017 bis zum 31.12.2017";"24.01.2019";"100%";"9f0e12c7f320e17bd3028846fa49a6eb";"789a9f23b6d01ed0";"00896";"Tue Jul 14 16:40:50 2020"
"Ramboll Holding GmbH (vormals: Rambøll Holding GmbH) Hamburg";"Rechnungslegung/ Finanzberichte";"» Jahresabschluss zum Geschäftsjahr vom 01.01.2015 bis zum 31.12.2015 Ergänzung der Veröffentlichung vom 26.02.2018";"24.12.2018";"100%";"9f0e12c7f320e17bd3028846fa49a6eb";"791a2956d917f9a6";"00896";"Tue Jul 14 16:40:50 2020"
"Ramboll Environ Germany GmbH Frankfurt am Main";"Rechnungslegung/ Finanzberichte";"» Jahresabschluss zum Geschäftsjahr vom 01.01.2017 bis zum 31.12.2017";"02.10.2018";"100%";"9f0e12c7f320e17bd3028846fa49a6eb";"5aee6b02ee40a317";"00896";"Tue Jul 14 16:40:50 2020"
"Ramboll Holding GmbH (vormals: Rambøll Holding GmbH) Hamburg";"Rechnungslegung/ Finanzberichte";"» Jahresabschluss zum Geschäftsjahr vom 01.01.2016 bis zum 31.12.2016";"17.09.2018";"100%";"9f0e12c7f320e17bd3028846fa49a6eb";"4b0406cb07e49640";"00896";"Tue Jul 14 16:40:50 2020"
"Ramboll GmbH Hamburg";"Rechnungslegung/ Finanzberichte";"» Jahresabschluss zum Geschäftsjahr vom 01.01.2016 bis zum 31.12.2016 Ergänzt am 11.03.2019";"16.05.2018";"83%";"9f0e12c7f320e17bd3028846fa49a6eb";"3bd8009f5bb70e1e";"00896";"Tue Jul 14 16:40:50 2020"
"Ramboll Management Consulting GmbH (vormals: Rambøll Management Consulting GmbH) Hamburg";"Rechnungslegung/ Finanzberichte";"» Jahresabschluss zum Geschäftsjahr vom 01.01.2016 bis zum 31.12.2016";"21.03.2018";"83%";"9f0e12c7f320e17bd3028846fa49a6eb";"ce055e8d98702083";"00896";"Tue Jul 14 16:40:50 2020"
"Ramboll Studio Dreiseitl GmbH (vormals: Atelier Dreiseitl GmbH) Überlingen";"Rechnungslegung/ Finanzberichte";"» Jahresabschluss zum Geschäftsjahr vom 01.01.2016 bis zum 31.12.2016";"14.03.2018";"83%";"9f0e12c7f320e17bd3028846fa49a6eb";"5c50a3280d902446";"00896";"Tue Jul 14 16:40:50 2020"
"Ramboll Holding GmbH (vormals: Rambøll Holding GmbH) Hamburg";"Rechnungslegung/ Finanzberichte";"» Jahresabschluss zum Geschäftsjahr vom 01.01.2015 bis zum 31.12.2015 Ergänzt am 24.12.2018";"26.02.2018";"83%";"9f0e12c7f320e17bd3028846fa49a6eb";"a0f498b237cc1c23";"00896";"Tue Jul 14 16:40:50 2020"
"Ramboll Environ Germany GmbH Frankfurt am Main";"Rechnungslegung/ Finanzberichte";"» Jahresabschluss zum Geschäftsjahr vom 01.01.2016 bis zum 31.12.2016";"08.11.2017";"83%";"9f0e12c7f320e17bd3028846fa49a6eb";"01748d8c64b87245";"00896";"Tue Jul 14 16:40:50 2020"
"Ramboll Studio Dreiseitl GmbH (vormals: Atelier Dreiseitl GmbH) Überlingen";"Rechnungslegung/ Finanzberichte";"» Jahresabschluss zum Geschäftsjahr vom 01.01.2015 bis zum 31.12.2015";"17.03.2017";"83%";"9f0e12c7f320e17bd3028846fa49a6eb";"9d02765a94fa0182";"00896";"Tue Jul 14 16:40:50 2020"
"Ramboll Management Consulting GmbH (vormals: Rambøll Management Consulting GmbH) Hamburg";"Rechnungslegung/ Finanzberichte";"» Jahresabschluss zum Geschäftsjahr vom 01.01.2015 bis zum 31.12.2015";"03.01.2017";"83%";"9f0e12c7f320e17bd3028846fa49a6eb";"7869426bc3611d5b";"00896";"Tue Jul 14 16:40:50 2020"
"Ramboll IMS Ingenieurgesellschaft mbH (vormals: IMS Ingenieurgesellschaft mbH) Hamburg";"Rechnungslegung/ Finanzberichte";"» Jahresabschluss zum Geschäftsjahr vom 01.01.2014 bis zum 31.12.2014 Berichtigung der Veröffentlichung vom 03.02.2016";"14.09.2016";"83%";"9f0e12c7f320e17bd3028846fa49a6eb";"84675c8b332b8806";"00896";"Tue Jul 14 16:40:50 2020"
