"Name";"Bereich";"Information";"V.-Datum";"Relevanz";"session.sessionid=";"fts_search_list.selected";"fts_search_list.destHistoryId";"timestamp"
"TEAMProjekt Outsourcing GmbH Raunheim";"Rechnungslegung/ Finanzberichte";"» Jahresabschluss zum Geschäftsjahr vom 01.01.2018 bis zum 31.12.2018";"08.01.2020";"100%";"9f640089e0eb51d0473f169a5e9dfb07";"49b9db7bcfe7f576";"30943";"Wed Jul 15 15:23:56 2020"
"TEAMProjekt Outsourcing GmbH Raunheim";"Rechnungslegung/ Finanzberichte";"» Jahresabschluss zum Geschäftsjahr vom 01.01.2017 bis zum 31.12.2017 Berichtigt am 02.07.2019";"27.09.2018";"100%";"9f640089e0eb51d0473f169a5e9dfb07";"9cf9efe2257e34a7";"30943";"Wed Jul 15 15:23:56 2020"
"TEAMProjekt Outsourcing GmbH (vormals: Team Projekt Outsourcing GmbH) Raunheim";"Rechnungslegung/ Finanzberichte";"» Jahresabschluss zum Geschäftsjahr vom 01.01.2015 bis zum 31.12.2015";"04.11.2016";"95%";"9f640089e0eb51d0473f169a5e9dfb07";"f905acd58271e98a";"30943";"Wed Jul 15 15:23:56 2020"
"TeamProjekt Outsourcing GmbH Frankfurt am Main";"Rechnungslegung/ Finanzberichte";"» Jahresabschluss zum 31.12.2007";"08.07.2008";"95%";"9f640089e0eb51d0473f169a5e9dfb07";"8ceae0ce0c9b90f7";"30943";"Wed Jul 15 15:23:56 2020"
"TeamProjekt Outsourcing GmbH Frankfurt am Main";"Rechnungslegung/ Finanzberichte";"» Jahresabschluss zum 31.12.2006";"14.01.2008";"95%";"9f640089e0eb51d0473f169a5e9dfb07";"29d5bc33526004e7";"30943";"Wed Jul 15 15:23:56 2020"
