"Name";"Bereich";"Information";"V.-Datum";"Relevanz";"session.sessionid=";"fts_search_list.selected";"fts_search_list.destHistoryId";"timestamp"
"Rau & Partner Unternehmensberatung GmbH Aschaffenburg";"Rechnungslegung/ Finanzberichte";"» Jahresabschluss zum Geschäftsjahr vom 01.01.2019 bis zum 31.12.2019";"14.07.2020";"100%";"c1affca00be00815e8f7ff00abde0b30";"e6a80d73433a3478";"70569";"Wed Jul 15 06:36:17 2020"
"Unternehmensberatung H & D GmbH München";"Rechnungslegung/ Finanzberichte";"» Jahresabschluss zum Geschäftsjahr vom 01.01.2019 bis zum 31.12.2019";"14.07.2020";"100%";"c1affca00be00815e8f7ff00abde0b30";"4043452aff5f8a27";"70569";"Wed Jul 15 06:36:17 2020"
"KEILIR Unternehmensberatung GmbH Buchholz";"Rechnungslegung/ Finanzberichte";"» Jahresabschluss zum Geschäftsjahr vom 01.01.2019 bis zum 31.12.2019";"14.07.2020";"100%";"c1affca00be00815e8f7ff00abde0b30";"a9812b5841bf9bc5";"70569";"Wed Jul 15 06:36:17 2020"
"viadee Unternehmensberatung AG Münster";"Rechnungslegung/ Finanzberichte";"» Jahresabschluss zum Geschäftsjahr vom 01.01.2019 bis zum 31.12.2019";"14.07.2020";"100%";"c1affca00be00815e8f7ff00abde0b30";"d3cc86b972e7eb93";"70569";"Wed Jul 15 06:36:17 2020"
"Strategy Analytics GmbH Marktforschung und Unternehmensberatung München";"Rechnungslegung/ Finanzberichte";"» Jahresabschluss zum Geschäftsjahr vom 01.07.2018 bis zum 30.06.2019";"10.07.2020";"100%";"c1affca00be00815e8f7ff00abde0b30";"556bcca78c08590d";"70569";"Wed Jul 15 06:36:17 2020"
"Peter Kintscher Unternehmensberatung-Immobilien GmbH Burscheid";"Rechnungslegung/ Finanzberichte";"» Jahresabschluss zum Geschäftsjahr vom 01.01.2019 bis zum 31.12.2019";"10.07.2020";"100%";"c1affca00be00815e8f7ff00abde0b30";"0af4a9ada2700717";"70569";"Wed Jul 15 06:36:17 2020"
"FWS Unternehmensberatung GmbH Essen";"Rechnungslegung/ Finanzberichte";"» Jahresabschluss zum Geschäftsjahr vom 01.09.2017 bis zum 31.08.2018";"09.07.2020";"100%";"c1affca00be00815e8f7ff00abde0b30";"ad2989accd240cc6";"70569";"Wed Jul 15 06:36:17 2020"
"Unternehmensberatung Währisch & Feykes GmbH Duisburg";"Rechnungslegung/ Finanzberichte";"» Jahresabschluss zum Geschäftsjahr vom 01.01.2019 bis zum 31.12.2019";"09.07.2020";"100%";"c1affca00be00815e8f7ff00abde0b30";"caf417e5e8d1d858";"70569";"Wed Jul 15 06:36:17 2020"
"Regina Hergenröther Sozialberatung & Unternehmensberatung GmbH Ostrau";"Rechnungslegung/ Finanzberichte";"» Jahresabschluss zum Geschäftsjahr vom 01.01.2019 bis zum 31.12.2019";"09.07.2020";"100%";"c1affca00be00815e8f7ff00abde0b30";"3f2d06a2b44efba2";"70569";"Wed Jul 15 06:36:17 2020"
"Wort & Zahl Unternehmensberatung GmbH Hamburg";"Rechnungslegung/ Finanzberichte";"» Jahresabschluss zum Geschäftsjahr vom 01.01.2019 bis zum 31.12.2019";"09.07.2020";"100%";"c1affca00be00815e8f7ff00abde0b30";"dab27e3556209156";"70569";"Wed Jul 15 06:36:17 2020"
"Saar + Scher Unternehmensberatung GmbH & Co. KG Saarbrücken";"Rechnungslegung/ Finanzberichte";"» Jahresabschluss zum Geschäftsjahr vom 01.01.2019 bis zum 31.12.2019";"07.07.2020";"100%";"c1affca00be00815e8f7ff00abde0b30";"db4b4a3c60467845";"70569";"Wed Jul 15 06:36:17 2020"
"Reisner und Frank GmbH,  Ingenieure und Unternehmensberater Gräfelfing";"Rechnungslegung/ Finanzberichte";"» Jahresabschluss zum Geschäftsjahr vom 01.01.2019 bis zum 31.12.2019";"07.07.2020";"100%";"c1affca00be00815e8f7ff00abde0b30";"6dccd73eb34e5ca5";"70569";"Wed Jul 15 06:36:17 2020"
"wexelkurs Unternehmensberatung GmbH Strande";"Rechnungslegung/ Finanzberichte";"» Jahresabschluss zum Geschäftsjahr vom 01.01.2019 bis zum 31.12.2019";"06.07.2020";"100%";"c1affca00be00815e8f7ff00abde0b30";"43fd0d5803b77d85";"70569";"Wed Jul 15 06:36:17 2020"
"dr. greif consilium Unternehmensberatung GmbH Leipzig";"Rechnungslegung/ Finanzberichte";"» Jahresabschluss zum Geschäftsjahr vom 01.01.2018 bis zum 31.12.2018";"03.07.2020";"100%";"c1affca00be00815e8f7ff00abde0b30";"00176d34c42f293c";"70569";"Wed Jul 15 06:36:17 2020"
"Gerald Hübschmann Unternehmensberatung GmbH Erlangen";"Rechnungslegung/ Finanzberichte";"» Jahresabschluss zum Geschäftsjahr vom 01.01.2019 bis zum 31.12.2019";"02.07.2020";"100%";"c1affca00be00815e8f7ff00abde0b30";"33849785e9e1cf43";"70569";"Wed Jul 15 06:36:17 2020"
"M. Consult Unternehmensberatung GmbH Erlangen";"Rechnungslegung/ Finanzberichte";"» Jahresabschluss zum Geschäftsjahr vom 01.01.2018 bis zum 31.12.2018 Berichtigung der Veröffentlichung vom 18.03.2020";"01.07.2020";"100%";"c1affca00be00815e8f7ff00abde0b30";"209c0e27577adbb0";"70569";"Wed Jul 15 06:36:17 2020"
"GfK Gesellschaft für Kapital- und Unternehmensberatung mbH Fröndenberg";"Rechnungslegung/ Finanzberichte";"» Jahresabschluss zum Geschäftsjahr vom 01.01.2019 bis zum 31.12.2019";"01.07.2020";"100%";"c1affca00be00815e8f7ff00abde0b30";"4dbf95293ab3f8ab";"70569";"Wed Jul 15 06:36:17 2020"
"SBM Unternehmensberatung GmbH Münster";"Rechnungslegung/ Finanzberichte";"» Jahresabschluss zum Geschäftsjahr vom 01.01.2019 bis zum 31.12.2019";"01.07.2020";"100%";"c1affca00be00815e8f7ff00abde0b30";"44ccf780e8182e69";"70569";"Wed Jul 15 06:36:17 2020"
"SEDLÁK  Unternehmensberatung (BDU) GmbH Ahrensburg";"Rechnungslegung/ Finanzberichte";"» Jahresabschluss zum Geschäftsjahr vom 01.01.2019 bis zum 31.12.2019";"30.06.2020";"100%";"c1affca00be00815e8f7ff00abde0b30";"a0a56c94b78a8bc9";"70569";"Wed Jul 15 06:36:17 2020"
"HPH Unternehmensberatung für Datenverarbeitung GmbH Tamm";"Rechnungslegung/ Finanzberichte";"» Jahresabschluss zum Geschäftsjahr vom 01.01.2018 bis zum 31.12.2018";"30.06.2020";"100%";"c1affca00be00815e8f7ff00abde0b30";"2038a6feb1488a61";"70569";"Wed Jul 15 06:36:17 2020"
